num	input_sequence	fol_translation	fol_adjustment-translation	fol_adjustment-eval	horn_translation	Analysis	comment	Symbols	
4309	it's okay to be attracted to someone else as long as you don't act on those feelings while in a relationship.	∀x∀y∃z(Relationship(x) ∧ In(y,x) ∧ IsTo(y,ATTRACTED,z) ∧ ¬ActOn(y,ATTRACTED) → evaluation(GOOD))	∀x∀y∀z(InRelationship(x,y) ∧ AttractedTo(x,z) ∧ ¬ActsOn(x,z) → evaluation(GOOD))	1			Attraction as constant? 	∀∃∧→¬∨	
4310	when someone is worried about their pet, it's rude to let them think the worst.	∀x∀y∀z(Pet(x) ∧ BelongsTo(x,y) ∧ WorriedAbout(y,x) ∧ LetsThinkWorst(z,y) → evaluation(BAD))	∀x∀y∀z(Pet(x) ∧ BelongsTo(x,z) ∧ WorriedAbout(z,x) ∧ LetThinkWorst(y,z) → evaluation(BAD))	3				∀∃∧→¬∨	
4400	you should go back to something you aren't done with.	∀x∀y(¬DoneWith(x,y) ∧ GoBackTo(x,y) → evaluation(GOOD))	∀x∀y(Thing(x) ∧ ¬DoneWith(y,x) ∧ GoBackTo(y,x) → evaluation(GOOD))	3				∀∃∧→¬∨	
4401	it's your place to tell people they need help.	∀x∀y(People(x) ∧ TellNeedHelp(y,x) → evaluation(GOOD))	∀x∀y(People(x) ∧ NeedHelp(x) → Tell(y,x)) → evaluation(GOOD)	1			Changed 'your place' to 'expected'	∀∃∧→¬∨	
4402	it is uncommon to have to make a decision that might upset people.	∃x∀y∀z(Decision(x) ∧ HaveToMake(y,x) ∧ Upset(x,z) ∧ People(z) → evaluation(BAD))	∀x∀y(Decision(x) ∧ MightUpset(x, y) ∧ People(y) → evaluation(BAD))	1				∀∃∧→¬∨	
4403	it's okay to let the world be come dependent.	∀x∀y(LetBecomeDependent(x,WORLD) → evaluation(GOOD))	∀x(World(x) ∧ BecomesDependent(x) → evaluation(GOOD))	2				∀∃∧→¬∨	
4404	it is wrong to discriminate against a group of people because you find them weird.	∀x∀y(GroupOfPeople(x) ∧ DiscriminateBecauseFindWeird(y,x) → evaluaton(BAD))	∀x∀y∀z(People(y) ∧ GroupOf(z,y) ∧ FindsWeird(x,z) ∧ DiscriminatesAgainst(x,z) → evaluation(BAD))	3			long predicate	∀∃∧→¬∨	
4405	if you have a low tire in your car, you should not fill it with air .	∀x∀y∀z(Tire(x) ∧ Low(x) ∧ Car(y) ∧ In(x,y) ∧ BelongsTo(y,z) ∧ FillWithAir(z,x) → evaluation(BAD))	∀x∀y(Car(x) ∧ Has(y,x) ∧ LowTire(x) ∧ ¬FillsWithAir(y,x) → evaluation(BAD))	3				∀∃∧→¬∨	
4406	it's good to care about the well being of loved ones.	∀x∀y∀z(LovedOne(x) ∧ WellBeingOf(y,x) ∧ CareAbout(z,y) → evaluation(GOOD))	∀x∀y(LovedOnes(y) ∧ CaresAboutWellBeing(x,y) → evaluation(GOOD))	3			POSSIBLE CONTRADICTION IN 3509: people are not expected to take care of their loved ones.	∀∃∧→¬∨	
4407	it's wrong that if you host a birthday party that you set the rules for it.	∀x∀y∀z(BirthdayParty(x) ∧ Host(y,x) ∧ Rules(z) ∧ SetFor(y,z,x) → evaluation(BAD))	∀x∀y(Hosts(x,y) ∧ BirthdayParty(y) ∧ SetsRulesFor(x,y) → evaluation(BAD))	3				∀∃∧→¬∨	
4408	you shouldn't give away your lunch money.	∀x∀y(LunchMoney(x) ∧ BelongsTo(x,y) ∧ GiveAway(y,x) → evaluation(BAD))	∀x∀y(Money(y) ∧ Lunch(y) ∧ BelongsTo(y,x) ∧ GiveAway(x,y) → evaluation(BAD))	2				∀∃∧→¬∨	
4409	it's wrong to let something that isn't a big deal ruin your day.	∀x∀y(LetRuinDay(x,y) ∧ ¬BigDeal(y) → evaluation(BAD))	∀x∀y(Thing(x) ∧ ¬BigDeal(x) ∧ LetsRuinDay(y,x) → evaluation(BAD))	3				∀∃∧→¬∨	
4410	it's not okay to transfer money to others.	∀x∀y∃z(Money(x) ∧ TransferTo(y,x,z) → evaluation(BAD))	∀x∀y∃z(People(x) ∧ People(z) ∧ Money(y) ∧ TransferTo(x,z,y) → evaluation(BAD))	3				∀∃∧→¬∨	
4500	it's good to order things online to save time and money.	∀x∀y∀z∀q(Thing(x) ∧ OrderOnline(y,x) ∧ Time(z) ∧ Money(q) ∧ Save(y,z) ∧ Save(y,q) → evaluation(GOOD))	∀x(OrderOnline(x) ∧ SavesTimeAndMoney(x) → evaluation(GOOD))	3				∀∃∧→¬∨	
4501	partners are not supposed to enjoy spending time together.	∀x∀y(Partners(x,y) ∧ EnjoySpendingTimeWith(x,y) ∧ EnjoySpendingTimeWith(y,x) → evaluation(BAD))	∀x∀y(Partners(x,y) ∧ EnjoysSpendingTimeTogether(x,y) → evaluation(BAD))	3				∀∃∧→¬∨	
4502	it's allowed to refuse to take a job that you're against.	∀x∀y(Job(x) ∧ Against(y,x) ∧ RefuseToTake(y,x) → evaluation(GOOD))	∀x∀y(Job(y) ∧ Against(x,y) ∧ RefuseToTake(x,y) → evaluation(GOOD))	3				∀∃∧→¬∨	
4503	it is understandable that you want to replace clothing that can no longer be considered acceptable office wear.	∀x∀y∀z(Clothing(x) ∧ ¬AcceptableWearTo(x,y) ∧ Office(y) ∧ WantToReplace(z,x) → evaluation(GOOD))	∀x∀y(Clothing(x) ∧ BelongsTo(x,y) ∧ ¬AcceptableOfficeWear(x) ∧ WantsToReplace(y, x) → evaluation(GOOD))	3				∀∃∧→¬∨	
4504	it's bad to hit the ball when you are up to bat.	∀x∀y(UpToBat(x) ∧ Ball(y) ∧ Hit(x,y) → evaluation(BAD))	∀x∀y(UpToBat(x) ∧ Ball(y) ∧ Hits(x,y) → evaluation(GOOD))	1				∀∃∧→¬∨	
4505	it's good to want people to be in good health.	∀x∀y∀z(People(x) ∧ Health(y) ∧ Good(y) ∧ WantToBeIn(z,x,y) → evaluation(GOOD))	INVALID FOL: ∀x∀y(People(y) ∧ Wants(x,GoodHealthOf(y)) → evaluation(GOOD))	0				∀∃∧→¬∨	
4506	you should always use proper grammar.	∀x∀y(ProperGrammar(x) ∧ Use(y,x) → evaluation(GOOD))	∀x(UsesProperGrammar(x) → evaluation(GOOD))	3				∀∃∧→¬∨	
4507	it's fine to want good things for yourself.	∀x∀y(Thing(x) ∧ Good(x) ∧ WantFor(y,x,y) → evaluation(GOOD))	∀x∀y(GoodThings(y) ∧ WantsFor(x, y) → evaluation(GOOD))	1				∀∃∧→¬∨	
4508	it's fine to listen to someone's complaints.	∀x∀y∀z(Complaint(x) ∧ BelongsTo(x,y) ∧ ListenTo(z,x) → evaluation(GOOD))	∀x∃y(Complaints(y) ∧ ListensTo(x,y) → evaluation(GOOD))	2				∀∃∧→¬∨	
4509	children should go to bed on time to get a full night's rest.	∀x∀y(Child(x) ∧ Bed(y) ∧ GoToOnTime(x,y) ∧ GetFullNightsRest(x) → evaluation(GOOD))	∀x∀y(Children(x) ∧ BedTime(y) ∧ GoToBedOnTime(x,y) → FullNightsRest(x) → evaluation(GOOD))	1				∀∃∧→¬∨	
4510	you should always use a different formula if the one you're using doesn't work.	∀x∃x(Formula(A) ∧ Formula(y) ∧ ¬Work(A) ∧ Use(x,A) ∧ Use(x,y) → evaluation(GOOD))	∀x∀y(Formula(x) ∧ Uses(y,x) ∧ ¬Works(y,x) → ∃z(Formula(z) ∧ Different(z,x) ∧ Uses(y,z))) → evaluation(GOOD)	1			constants instead of equality	∀∃∧→¬∨	
4600	it's not okay to complain to your employee.	∀x∀y(EmployeeOf(x,y) ∧ ComplainTo(y,x) → evaluation(BAD))	∀x∀y(Employer(x) ∧ Employee(y) ∧ ComplainsTo(x,y) → evaluation(BAD))	2				∀∃∧→¬∨	
4601	you shouldn't let your kids fight each other on your behalf.	∀x∀y∀z(ChildOf(y,x) ∧ ChildOf(z,x) ∧ LetFightOnBehalfOf(x,y,z,x) → evaluation(BAD))	∀x∀y∀z(Kids(y,x) ∧ FightOnBehalfOf(y,z,x) → evaluation(BAD))	1				∀∃∧→¬∨	
4602	it is bad to be understanding if your friend can't hangout due to social anxiety.	∀x∀y∀z(FriendOf(x,y) ∧ SocialAnxiety(z) ∧ ¬HangOutDueTo(x,z) ∧ Understanding(y) → evaluation(BAD))	∀x∀y(SocialAnxiety(y) ∧ CanNotHangout(y) ∧ Friend(y,x) ∧ Understanding(x) → evaluation(BAD))	2				∀∃∧→¬∨	
4603	it's encouraged you see a therapist if you can't get over something from the past	∀x∀y∀z(FromPast(x) ∧ ¬GetOver(y,x) ∧ Therapist(z) ∧ See(y,z) → evaluation(GOOD))	∀x∀y∀z(Past(z) ∧ CannotGetOver(x,z) → SeesTherapist(x,y) → evaluation(GOOD))	1				∀∃∧→¬∨	
4604	it's bad to try to make better friends.	∀x∀y∀z(Friend(x) ∧ Friend(y) ∧ BetterThan(x,y) ∧ TryToMake(z,x) → evaluation(BAD))	∀x∀y(Try(x) ∧ MakeBetterFriends(x,y) → evaluation(BAD))	1			Don't know if this is best way to represent	∀∃∧→¬∨	
4605	it's irrational if you're afraid of your spouse when they return home from combat.	∀x∀y∀z∀q(SpouseOf(x,y) ∧ Combat(z) ∧ Home(q) ∧ ReturnToFrom(x,q,z) ∧ AfraidOf(y,x) → evaluation(BAD))	∀x∀y(AfraidOf(x,y) ∧ SpouseOf(y,x) ∧ ReturnsFromCombat(y) → evaluation(BAD))	3				∀∃∧→¬∨	
4606	you shouldn't confront people if you have a problem with them.	∀x∀y∀z(Problem(x) ∧ People(y) ∧ HaveWith(z,x,y) ∧ Confront(z,y) → evaluation(BAD))	∀x∀y(ProblemWith(y,x) ∧ Confronts(y,x) → evaluation(BAD))	2				∀∃∧→¬∨	
4607	you shouldn't try to control your anger with a loved one.	∀x∀y(Has(x,ANGER) ∧ LovedOne(y) ∧ TryToControlWith(x,ANGER,y) → evaluation(BAD))	∀x∀y(Loves(x,y) ∧ TriesToControlWith(x,Anger,y) → evaluation(BAD))	3				∀∃∧→¬∨	
4608	when you want to be president, it's wrong to work hard in school .	∀x∀y(WantsToBe(x,PRESIDENT) ∧ School(y) ∧ WorkHardIn(x,y) → evaluation(BAD))	∀x∀y(WantsToBe(x, PRESIDENT) ∧ School(y) ∧ WorksHardIn(x,y) → evaluation(BAD))	3				∀∃∧→¬∨	
4609	you should not be considerate of your neighbors when you're listening to music in your apartment.	∀x∀y∀z∀q(Music(x) ∧ ListeningTo(y,x) ∧ In(y,z) ∧ Apartment(z) ∧ BelongsTo(z,y) ∧ NeighborsOf(q,y) ∧ ¬BeConsiderateOf(z,q) → evaluation(BAD))	∀x∀y∀z(Neighbor(y,x) ∧ Apartment(z,x) ∧ ListensToMusicIn(x,z) ∧ ¬ConsiderateOf(x,y) → evaluation(GOOD))	3				∀∃∧→¬∨	
4610	you should not cancel plans in an emergency.	∀x∀y∀z(Emergency(x) ∧ Plans(y) ∧ In(z,x) ∧ Cancel(z,y) → evaluation(BAD))	∀x∀y(Plan(x) ∧ Emergency(y) ∧ CancelsIn(y,x) → evaluation(GOOD))	1				∀∃∧→¬∨	
4701	it's ok to be nervous about new experiences.	∀x∀y(Experience(x) ∧ New(x) ∧ NervousAbout(y,x) → evaluation(GOOD))	∀x∀y(NewExperience(y) ∧ NervousAbout(x, y) → evaluation(GOOD))	3				∀∃∧→¬∨	
4702	it's bad to be very smart.	∀x(VerySmart(x) → evaluation(BAD))	∀x(Smart(x) ∧ Very(x) → evaluation(BAD))	2				∀∃∧→¬∨	
4703	it's unreasonable to be excited when your team wins a game.	∀x∀y(Team(x) ∧ BelongsTo(x,y) ∧ WinsGame(x) ∧ Excited(y) → evaluation(BAD))	∀x∀y∀z(Team(y) ∧ MemberOf(x, y) ∧ WinsGame(y, z) ∧ Excited(x) → evaluation(BAD))	3				∀∃∧→¬∨	
4704	you shouldn't do what you can to maintain a relationship with a girlfriend.	∀x∀y(Girlfriend(x) ∧ DoWhatYouCanToMaintainRelationshipWith(y,x) → evaluation(BAD))	∀x∀y(GirlfriendOf(y, x) ∧ DoesWhatCanToMaintainRelationship(x, y) → evaluation(GOOD))	1			long predicate	∀∃∧→¬∨	
4705	it's bad to get gifts for people who help you out.	∀x∀y∀z(People(x) ∧ HelpOut(x,y) ∧ Gift(z) ∧ GetFor(y,z,x) → evaluation(BAD))	∀x∀y∀z(People(x) ∧ Helps(y,x) ∧ GetsGiftFor(z,x) → evaluation(GOOD))	1				∀∃∧→¬∨	
4706	it's wrong to do things that we find entertaining or humorous.	∀x∀y(Thing(x) ∧ (Entertaining(x) ∨ Humorous(x)) ∧ Do(y,x) → evaluation(BAD))	∀x∀y∀z(Thing(x) ∧ Do(y,x) ∧ (Entertaining(x) ∨ Humorous(x)) → evaluation(BAD))	3				∀∃∧→¬∨	
4707	it's understandable if you have romantic feelings for your doctor.	∀x∀y∀z(RomaticFeeling(x) ∧ Doctor(y) ∧ BelongsTo(y,z) ∧ HaveFor(z,x,y) → evaluation(GOOD))	∀x∀y(Patient(x) ∧ Doctor(y) ∧ HaveRomanticFeelings(x,y) → evaluation(GOOD))	2			belongs is not really right...	∀∃∧→¬∨	
4708	it's okay to eat too much junk food and soda because it's bad for you.	∀x∀y∀z(JunkFood(x) ∧ Soda(y) ∧ EatTooMuchBecauseBadFor(z,x,z) ∧ EatTooMuchBecauseBadFor(z,y,z) → evaluation(GOOD))	INVALID FOL: ∀x∀y(JunkFood(x) ∧ Soda(y) ∧ EatsTooMuch(You,x,y) → evaluation(GOOD)) ∧ ∀x∀y(JunkFood(x) ∧ Soda(y) ∧ BadFor(You,x,y) → evaluation(GOOD))	0			"because it's bad for you" necessary to include?	∀∃∧→¬∨	
4709	you should try to understand that people sometimes have problems weighing on their minds that make it hard for them to focus you.	∃x∃y∀z∀q(People(x) ∧ Problem(y) ∧ MindOf(z,x) ∧ TryToUnderstandWeighOnMakeItHardToFocusOn(q,y,x,z) → evaluation(GOOD))	∀x∀y∃z∃w(People(z) ∧ Problem(w) ∧ OnMind(w,z) ∧ MakesHardToFocus(w,z,y) ∧ TriesToUnderstand(x,w) → evaluation(GOOD))	2			crazy long predicate...	∀∃∧→¬∨	
4710	you should always answer when someone is at the door.	∀x∀y∀z(Door(x) ∧ At(y,x) ∧ Answer(z) → evaluation(GOOD))	∀x∀y(AtTheDoor(y) ∧ SomeoneIs(y) ∧ AnswerWhen(x,y) → evaluation(GOOD))	1				∀∃∧→¬∨	
4800	you shouldn't always be proud of someone's college education.	∃x∃y∃z(CollegeEducation(x) ∧ BelongsTo(x,y) ∧ ProudOf(z,x) → evaluation(BAD))	∀x∀y(Education(y) ∧ College(y) ∧ BelongsTo(y,x) ∧ AlwaysProudOf(x,y) → evaluation(BAD))	1				∀∃∧→¬∨	
4801	people are not expected to work until the end of their scheduled shift.	∀x∀y∀z(People(x) ∧ EndOfScheduledShift(y) ∧ BelongsTo(y,x) ∧ WorkBefore(x,y) → evaluation(BAD))	∀x∀y(People(x) ∧ Shift(y,x) ∧ WorksUntilEndOf(x,y) → evaluation(GOOD))	1				∀∃∧→¬∨	
4802	it is not ok to want to be sure before marriage.	∀x∀y(Marriage(x) ∧ WantToBeSureBefore(y,x) → evaluation(BAD))	∀x∀y(WantsToBe(x, SURE) ∧ Before(y, MARRIAGE) ∧ To(x, y) → evaluation(GOOD))	1				∀∃∧→¬∨	
4803	it is bad to want to bring your family pet in even if it means you have to sneak him in.	∀x∀y∀z(FamilyPet(x) ∧ BelongsTo(x,y) ∧ WantToBringIn(y,x) ∧ (HaveToSneakIn(y,x) ∨ ¬HaveToSneakIn(y,x)) → evaluation(BAD))	∀x∀y(FamilyPet(y,x) ∧ WantsToBringIn(x,y) ∧ IntentToSneakIn(x,y) → evaluation(BAD))	2				∀∃∧→¬∨	
4804	people are expected to be faithful.	∀x(People(x) ∧ Faithful(x) → evaluation(GOOD))	∀x(People(x) → Faithful(x) → evaluation(GOOD))	1				∀∃∧→¬∨	
4805	it's rude to get someone banned.	∀x∀y(GetBanned(x,y) → evaluation(BAD))	∀x∀y(Banned(y) ∧ CausedBy(x,y) → evaluation(BAD))	1				∀∃∧→¬∨	
4806	it is polite to eat people's food if you know they are hungry.	∀x∀y∀z(People(x) ∧ Food(y) ∧ BelongsTo(y,x) ∧ Hungry(x) ∧ KnowsIsHungry(z) ∧ Eat(z,y) → evaluation(GOOD))	INVALID FOL: ∀x∀y∀z(People(x) ∧ Food(y) ∧ BelongsTo(y,x) ∧ Knows(z, Hungry(x)) ∧ Eats(z, y) → evaluation(GOOD))	0				∀∃∧→¬∨	
4807	it's wrong to ignore charity requests.	∀x∀y(CharityRequest(x) ∧ Ignore(y,x) → evaluation(BAD))	∀x∀y(CharityRequest(x) ∧ Ignores(y,x) → evaluation(BAD))	3				∀∃∧→¬∨	
4808	it is polite to criticize someone else's parenting.	∀x∀y∃z(Parenting(x) ∧ BelongsTo(x,y) ∧ Criticize(z,x) → evaluation(GOOD))	∀x∀y∃z(ParentingOf(z,y) ∧ Criticizes(x,y) → evaluation(GOOD))	2				∀∃∧→¬∨	
4809	you can be expected to try to find resources on being the best parent you can be.	∀x∀y(ResourcesOnBeingBestParent(x) ∧ TryToFind(y,x) → evaluation(GOOD))	∀x∀y(Parent(x) ∧ Best(y) ∧ TriesToFindResourcesOn(x, y) → evaluation(GOOD))	1				∀∃∧→¬∨	
4810	it's bad to be supportive when someone is severely anxious.	∀x∀y(SeverlyAnxious(x) ∧ Supportive(y) → evaluation(BAD))	∀x∀y(Anxious(y) ∧ Severely(y) ∧ Supportive(x,y) → evaluation(BAD))	2				∀∃∧→¬∨	
4900	it is immature to spend your time watching cartoons.	∀x∀y∀z(Cartoon(x) ∧ Time(y) ∧ BelongsTo(y,z) ∧ SpendAllOn(z,y,x) → evaluation(BAD))	∀x∀y(Time(x) ∧ Cartoons(y) ∧ SpendTime(x,y) ∧ Watch(x) → evaluation(BAD))	1				∀∃∧→¬∨	
4901	it's fine to use sex to get what you want.	∀x∀y∀z(Sex(x) ∧ Want(y,z) ∧ UseToGet(y,x,z) → evaluation(GOOD))	∀x∀y(Uses(x, SEX) ∧ Wants(x, y) → evaluation(GOOD))	1				∀∃∧→¬∨	
4902	it's expected that you keep your weird fetishes private.	∀x∀y(Fetish(x) ∧ Weird(x) ∧ BelongsTo(x,y) ∧ KeepPrive(y,x) → evaluation(GOOD))	∀x∀y(WeirdFetish(x) ∧ BelongsTo(x,y) ∧ KeepPrivate(y,x) → evaluation(GOOD))	3				∀∃∧→¬∨	
4903	it's right not to go to your work christmas party.	∀x∀y(Work(x) ∧ BelongsTo(x,y) ∧ ChristmasParty(z) ∧ For(z,x) ∧ ¬GoTo(y,z) → evaluation(GOOD))	∀x∀y(WorkParty(y) ∧ Christmas(y) ∧ BelongsTo(y,x) ∧ ¬GoTo(x,y) → evaluation(GOOD))	2				∀∃∧→¬∨	
4904	it's good to want to have a sense of humor.	∀x∀y(SenseOfHumor(x) ∧ WantToHave(y,x) → evaluation(GOOD))	∀x(Wants(x,SENSE_OF_HUMOR) → evaluation(GOOD))	3				∀∃∧→¬∨	
4905	it is sentimental to hold onto texts from dead people.	∀x∀y∀z(People(x) ∧ Dead(x) ∧ Text(y) ∧ From(y,x) ∧ HoldOnto(z,y) → evaluation(BAD))	∀x∀y(Texts(x) ∧ From(y, x) ∧ Dead(y) ∧ HoldsOnTo(z,x) → evaluation(GOOD))	3			unsure evaluation	∀∃∧→¬∨	
4906	you have no right to talk to anyone you like.	∀x∀y(Like(x,y) ∧ TalkTo(x,y) → evaluation(BAD))	∀x∀y∀z(People(x) ∧ Likes(x,y) ∧ TalkTo(x,y) → evaluation(BAD))	2				∀∃∧→¬∨	
4907	you shouldn't lose someone's gift.	∀x∀y∀z(Gift(x) ∧ BelongsTo(x,y) ∧ Lose(z,x) → evaluation(BAD))	∀x∀y∀z(Gift(y) ∧ BelongsTo(y,x) ∧ Lose(z,y) → evaluation(BAD))	3				∀∃∧→¬∨	
4908	it's bad to have a fulfilling career.	∀x∀y(Career(x) ∧ Fulfilling(x) ∧ Have(y,x) → evaluation(BAD))	∀x(Career(x) ∧ Fulfilling(x) → evaluation(BAD))	3				∀∃∧→¬∨	
4909	it's okay to be rude to service employees	∀x∀y(ServiceEmployee(x) ∧ RudeTo(y,x) → evaluation(GOOD))	∀x∀y(ServiceEmployee(y) ∧ RudeTo(x,y) → evaluation(GOOD))	3				∀∃∧→¬∨	
4910	if you're really depressed, you should not take time off .	∀x∀y(ReallyDepressed(x) ∧ TakeTimeOff(x) → evaluation(BAD))	∀x(Depressed(x) ∧ ¬TakesTimeOff(x) → evaluation(BAD))	1				∀∃∧→¬∨	
5000	you should not always pay back money you owe.	∃x∃y(Money(x) ∧ Owe(y,x) ∧ PayBack(y,x) → evaluation(BAD))	∀x∀y(OwesMoneyTo(x,y) ∧ AlwaysPaysBack(x,y) → evaluation(GOOD))	1				∀∃∧→¬∨	
5001	it's okay to call your husband out when he's fighting over something stupid with a friend.	∀x∀y∀z∀q(HusbandOf(x,y) ∧ FriendOf(z,x) ∧ Stupid(q) ∧ FightOverWith(x,q,z) ∧ CallOut(y,x) → evaluation(GOOD))	∀x∀y∀z∀w(HusbandOf(x,y) ∧ FriendOf(z,y) ∧ FightsOverSomethingStupid(y,z,w) ∧ CallsOut(x,y) → evaluation(GOOD))	2				∀∃∧→¬∨	
5002	it's bad to start a new job after college to earn money and experience.	∀x∀y∀z∀q∀r(College(x) ∧ Job(y) ∧ New(y) ∧ StartAfterToEarn(z,y,x,q) ∧ Money(q) ∧ Experience(r) ∧ StartAfterToEarn(z,y,x,r) → evaluation(BAD))	∀x∀y∀z((CollegeGraduate(x) ∧ Job(y) ∧ StartAfter(x,y)) ∧ (Earns(x,z) ∧ Money(z)) ∧ (Gains(x,EXPERIENCE)) → evaluation(GOOD))	1				∀∃∧→¬∨	
5003	it's polite to change plans last minute that affect other people	∀x∃y∀z(Plan(x) ∧ People(y) ∧ ChangeLastMinute(z,x) ∧ Affect(x,y) → evaluation(GOOD))	∀x∀y∃z(Plans(x) ∧ LastMinuteChange(x) ∧ Affects(x,z) ∧ People(z) ∧ IsPolite(y,x) → evaluation(BAD))	1				∀∃∧→¬∨	
5004	it's not ok that it takes practice to learn a new skill.	∀x∀y(Practice(x) ∧ Skill(y) ∧ New(y) ∧ TakesToLearn(x,y) → evaluation(BAD))	∀x∀y(Learn(x,y) ∧ NewSkill(y) ∧ TakesPractice(x) → evaluation(GOOD))	1				∀∃∧→¬∨	
5005	it is ok to dress like a grim reaper if it is halloween.	∀x∀y(DressLikeOn(x,GRIMREAPER,HALLOWEEN) → evaluation(GOOD))	∀x(DressesAs(x, GRIM_REAPER) ∧ IsToday(HALLOWEEN) → evaluation(GOOD))	3			grim reaper constant?	∀∃∧→¬∨	
5006	serious conversations should be held in person.	∀x(Conversation(x) ∧ Serious(x) ∧ HeldInPerson(x) → evaluation(GOOD))	∀x∀y(SeriousConversation(x) ∧ Held(y, x) ∧ InPerson(y) → evaluation(GOOD))	1				∀∃∧→¬∨	
5007	it is okay to be self concious.	∀x(SelfConcious(x) → evaluation(GOOD))	∀x(SelfConscious(x) → evaluation(GOOD))	3				∀∃∧→¬∨	
5008	people should not research nutrition so they know what their body actually needs.	∀x∀y∀z∀q(Nutrition(x) ∧ People(y) ∧ Research(y,x) ∧ Body(z) ∧ BelongsTo(z,y) ∧ Need(z,q) ∧ Know(y,q) → evaluation(BAD))	∀x∀y∀z(People(x) ∧ BodyOf(y,x) ∧ Nutrition(z) ∧ ¬Research(x,z) → evaluation(GOOD))	1				∀∃∧→¬∨	
5009	kids cannot be expected to be embarrassed by their parents.	∀x∀y(Kid(x) ∧ ParentOf(y,x) ∧ EmbarrassedBy(x,y) → evaluation(BAD))	∀x∀y(Kid(x) ∧ Parent(y,x) ∧ EmbarrassedBy(x,y) → evaluation(BAD))	3				∀∃∧→¬∨	
5010	you shouldn't say you're allergic to water because that's not a real allergy.	∀x∀y(Water(x) ∧ SaysAllergicTo(y,x) ∧ ¬RealAllergy(x) → evaluation(BAD))	INVALID FOL: ∀x(Says(x, AllergicTo(WATER)) → ¬RealAllergy(AllergicTo(WATER)) → evaluation(BAD))	0				∀∃∧→¬∨	
5100	it's not understandable that crazy people shop for more than just food at a supermarket.	∀x∀y∀z∀q(People(x) ∧ Crazy(x) ∧ ¬Food(y) ∧ Food(q) ∧ Supermarket(z) ∧ ShopForAt(x,y,z) ∧ ShopForAt(x,q,z) → evaluation(BAD))	∀x∀y∀z(Crazy(x) ∧ People(x) ∧ Supermarket(y) ∧ ShopAtForMoreThanJustFood(x,y,z) → evaluation(BAD))	3			Not sure if this covers it	∀∃∧→¬∨	
5101	it's irrational if you're hurt when your friend cancels plans at the last minute.	∀x∀y∀z(FriendOf(x,y) ∧ Plan(z) ∧ CancelLastMinute(x,z) ∧ Hurt(y) → evaluation(BAD))	∀x∀y(FriendOf(y,x) ∧ CancelsPlansAtLastMinute(y) ∧ Hurt(x) → evaluation(BAD))	3				∀∃∧→¬∨	
5102	it's bad if you don't like your grandmother's hairdo.	∀x∀y∀z(GrandmotherOf(x,y) ∧ Hairdo(z) ∧ BelongsTo(z,x) ∧ ¬Like(y,z) → evaluation(BAD))	∀x∀y∀z(GrandmotherOf(x,y) ∧ Hairdo(z,x) ∧ ¬Likes(y,z) → evaluation(BAD))	3				∀∃∧→¬∨	
5103	it's okay to want to lose weight responsibly.	∀x∀yWeight(x) ∧ WantToLoseResponsibly(y,x) → evaluation(GOOD))	∀x(People(x) ∧ Want(x, LoseWeight) ∧ DoResponsibly(x) → evaluation(GOOD))	1				∀∃∧→¬∨	
5104	you should always keep your friends in the know.	∀x∀y(FriendOf(x,y) ∧ KeepIn(y,x,THEKNOW) → evaluation(GOOD))	∀x∀y(Friends(x,y) ∧ KeepsInTheKnow(y,x) → evaluation(GOOD))	3			The know as constant?	∀∃∧→¬∨	
5105	it's expected that you feel hurt when thinking about your ex.	∀x∀y(ExOf(x,y) ∧ ThinkAbout(y,x) ∧ FeelHurt(y) → evaluation(GOOD))	∀x∀y(ExOf(y,x) ∧ ThinksAbout(x,y) ∧ FeelsHurt(x) → evaluation(GOOD))	3				∀∃∧→¬∨	
5106	it is ok to put a kid in a situation where the child is depressed.	∀x∀y(Kid(x) ∧ PutInSituationWhereIs(y,x,DEPRESSED) → evaluation(GOOD))	∀x∀y(Kid(x) ∧ Situation(y) ∧ PutIn(x,y) ∧ Depressed(x) → evaluation(BAD))	1				∀∃∧→¬∨	
5107	it is unreasonable that a parent would know what their child would like as a gift.	∀x∀y∀z(ChildOf(x,y) ∧ Parent(y) ∧ Gift(z) ∧ KnowWhatWouldLikeAs(y,x,z) → evaluation(BAD))	∀x∀y∀z(ParentOf(x, y) ∧ Child(y) ∧ Gift(z) ∧ WouldLikeAsGift(y, z) ∧ Knows(x, y, z) → evaluation(BAD))	1				∀∃∧→¬∨	
5108	it's rude to judge other people based on things that they cannot change.	∃x∀y∀z(CannotChange(x,y) ∧ People(x) ∧ JudgeBasedOn(z,x,y) → evaluation(BAD))	∀x∀y∀z∃w(People(w) ∧ Thing(z) ∧ CannotChange(w,z) ∧ JudgingBasedOn(x, w, z) → evaluation(BAD))	3				∀∃∧→¬∨	
5109	you should not unwrap your silverware when there's a napkin around it.	∀x∀y∀z(Silverware(x) ∧ Napkin(y) ∧ Around(y,x) ∧ Unwrap(z,x) → evaluation(BAD))	∀x∀y(Silverware(x) ∧ Around(NAPKIN,x) ∧ Unwraps(y,x) → evaluation(BAD))	3				∀∃∧→¬∨	
5110	it is good to treat others the same.	∀x∀y∃z∀q(Treatment(x) ∧ TreatInWay(y,z,x) → evaluation(GOOD))	∀x∀y∀z(People(x) ∧ People(y) ∧ TreatsSameAs(z,x,y) → evaluation(GOOD))	3				∀∃∧→¬∨	
5200	you should be confrontational in the workplace.	∀x(ConfrontationalIn(x,WORKSPACE) → evaluation(GOOD))	∀x∀y(Workplace(y) ∧ In(x,y) ∧ Confrontational(x) → evaluation(GOOD))	3				∀∃∧→¬∨	
5201	it is not cute to see a little kid dancing in a tutu.	∀x∀y(LittleKid(x) ∧ DancingIn(x,TUTU) ∧ See(y,x) → evaluation(BAD))	∀x∀y∀z(Kid(x) ∧ Little(x) ∧ Tutu(y) ∧ DancingIn(x,y) ∧ Sees(z,x) → evaluation(BAD))	3				∀∃∧→¬∨	
5202	you can expect everyone to have a partner.	∀x(HasPartner(x) → evaluation(GOOD))	∀x∃y(People(x) ∧ PartnerOf(y,x)) → evaluation(GOOD)	2				∀∃∧→¬∨	
5203	it is good to recognize the good performance of others.	∀x∃y∀z(Performance(z) ∧ Good(z) ∧ Belongsto(z,y) ∧ RecognizeOf(x,z,y) → evaluation(GOOD))	∀x∀y∃z(GoodPerformance(z) ∧ Other(x,z) ∧ Recognize(y,z) → evaluation(GOOD))	2				∀∃∧→¬∨	
5204	you should text with a married man behind his wife's back.	∀x∀y∀z(MarriedMan(x) ∧ WifeOf(y,x) ∧ TextBehindBackOf(z,x,y)  → evaluation(GOOD))	∀x∀y∀z(Man(x) ∧ MarriedTo(x,y) ∧ TextsWith(z,x) ∧ BehindBackOf(z,y) → evaluation(GOOD))	1				∀∃∧→¬∨	
5205	it's bad to consult your parent before you sell something precious and expensive.	∀x∀y∀z(ParentOf(x,y) ∧ Consult(y,x) ∧ Precious(z) ∧ Expensive(z) ∧ WillSell(y,z)  → evaluation(BAD))	INVALID FOL: ∀x∀y∀z∀w(ParentOf(y,x) ∧ Precious(z) ∧ Expensive(z) ∧ ConsultsBefore(x,y,Sells(x,z)) → evaluation(BAD))	0				∀∃∧→¬∨	
