num	input_sequence	fol_translation	fol_adjustment-translation	fol_adjustment-eval	horn_translation	Analysis	comment	Symbols	
7006	it's good to try and face your faults.	∀x∀y(Fault(x) ∧ BelongsTo(x,y) ∧ TryToFace(y,x) → evaluation(GOOD))	∀x∀y(Fault(y) ∧ Has(x, y) ∧ TriesToFace(x, y) → evaluation(GOOD))	3				∀∃∧→¬∨	
7007	it is not rude to kick someone off a team.	∀x∀y∀z(Team(x) ∧ KickOff(y,z,x) → evaluation(GOOD))	∀x∀y∀z(Person(x) ∧ Team(y) ∧ KicksOff(x,z,y) → evaluation(GOOD))	3				∀∃∧→¬∨	
7008	it's bad to leave someone who is controlling of your social life.	∀x∀y∀z(SocialLife(x) ∧ BelongsTo(x,y) ∧ Controlling(z,x) ∧ Leave(y,z) → evaluation(BAD))	∀x∀y∀z(Control(z,y,social_life) ∧ People(x) ∧ People(y) ∧ Leave(x, z) → evaluation(GOOD))	1				∀∃∧→¬∨	
7009	it is expected people will clean their apartments.	∀x∀y(Apartment(x) ∧ People(y) ∧ BelongsTo(x,y) ∧ Clean(y,x) → evaluation(GOOD))	∀x∀y(People(x) ∧ Apartment(y) ∧ Owns(x,y) ∧ WillClean(x,y) → evaluation(GOOD))	3				∀∃∧→¬∨	
7010	it's depraved to enjoy breaking people's hearts.	∀x∀y∀z(People(x) ∧ Heart(y) ∧ BelongsTo(y,z) ∧ EnjoyBreaking(z,y) → evaluation(BAD))	INVALID FOL: ∀x∀y∀z(Person(y) ∧ HeartOf(y,z) ∧ Breaks(x,z) ∧ Enjoys(x,Breaks(x,z)) → evaluation(BAD))	0				∀∃∧→¬∨	
7100	it's good to show affection to the people you love.	∀x∀y∀z(People(x) ∧ Love(y,x) ∧ Affection(z) ∧ ShowTo(y,z,x) → evaluation(GOOD))	∀x∀y(Love(y,x) ∧ People(y) ∧ ShowsAffectionTo(x,y) → evaluation(GOOD))	1				∀∃∧→¬∨	
7101	it's not is acceptable to not visit church on sunday.	∀x∀y(Church(x)  ¬VisitOn(y,x,SUNDAY) → evaluation(BAD))	INVALID FOL: ∀x(SundayToday() ∧ ¬Visit(x, CHURCH) → evaluation(BAD))	0				∀∃∧→¬∨	
7102	you should not always make sure your fridge is stocked full of food	∃x∃y∃z(Fridge(x) ∧ BelongsTo(x,y) ∧ Food(z) ∧ ¬MakeSureStockedFullOf(y,x,z) → evaluation(GOOD))	∀x∀y(Fridge(x) ∧ BelongsTo(x,y) ∧ ∀z(Food(z) ∧ StockedWith(x,z)) → evaluation(BAD))	2			not always = all variables using existential quantifier	∀∃∧→¬∨	
7103	it is irrational that not everyone will enjoy a shift swap at work.	∀x∃y∀z(ShiftSwap(x) ∧ ¬Enjoy(y,x) ∧ Work(z) ∧ At(x,z) → evaluation(BAD))	∀x∀y(Work(x) ∧ ShiftSwap(y,x) ∧ ¬∀z(People(z) → Enjoys(z,y)) → evaluation(BAD))	3			not everyone	∀∃∧→¬∨	
7104	it's okay to stereotype people because of their ethnicity.	∀x∀y∀z(Ethnicity(x) ∧ BelongsTo(x,y) ∧ People(y) ∧ StereotypeBasedOn(z,y,x) → evaluation(GOOD))	∀x∀y(People(x) ∧ EthnicityOf(y, x) ∧ StereotypeBasedOn(y) → evaluation(GOOD))	3				∀∃∧→¬∨	
7105	it's okay to feel happy even with mediocre test results.	∀x∀y(TestResult(x) ∧ Mediocre(x) ∧ FeelHappyWith(y,x) → evaluation(GOOD))	∀x∀y(TestResult(y) ∧ Mediocre(y) ∧ Feels(x,y) ∧ Happy(x) → evaluation(GOOD))	1				∀∃∧→¬∨	
7106	you should disappoint your pets.	∀x∀y(Pet(x) ∧ BelongsTo(x,y) ∧ Dissapoint(y,x) → evaluation(GOOD))	∀x∀y(Pet(y) ∧ BelongsTo(y,x) ∧ Disappoints(x,y) → evaluation(BAD))	1				∀∃∧→¬∨	
7107	it's expected to enjoy giving inmates cavity searches.	∀x∀y∀z(CavitySearch(x) ∧ Inmate(y) ∧ EnjoyGiving(z,y,x) → evaluation(GOOD))	INVALID FOL: ∀x∀y∀z(Inmate(y) ∧ CavitySearch(z,y) ∧ Give(x,z) ∧ Enjoy(x,Giving(z)) → evaluation(GOOD))	0				∀∃∧→¬∨	
7108	it's impolite to offer to pay for your wedding date's travel fees.	∀x∀y(BelongsTo(WEDDINGDATE,x) ∧ TravelFeeFor(y,WEDDINGDATE) ∧ OfferToPayFor(x,y) → evaluation(BAD))	∀x∀y∀z(DateAtWedding(y,x) ∧ TravelFees(z,y) ∧ OffersToPay(x,z) → evaluation(BAD))	3				∀∃∧→¬∨	
7109	it's not okay to tell parents what is best for their kids.	∀x∀y∀z(Parent(x) ∧ ChildOf(y,x) ∧ TellWhatIsBestFor(z,y) → evaluation(BAD))	∀x∀y∀z(ParentsOf(y, z) ∧ Kids(z, x) ∧ TellsWhatIsBest(x, z) → evaluation(BAD))	1				∀∃∧→¬∨	
7110	if you get a flat tire your spouse isn't expected to help you change it.	∀x∀y∀z(SpouseOf(x,y) ∧ Tire(z) ∧ Flat(z) ∧ Get(y,z) ∧ HelpChange(x,y,z) → evaluation(BAD))	∀x∀y∀z(IsSpouseOf(x,y) ∧ HasFlatTire(z,x) ∧ ¬HelpsChange(y,z) → evaluation(GOOD))	2				∀∃∧→¬∨	
7200	if you take someone elses food it is important to make sure no one else sees you	∀x∃y∀z∃q(Food(x) ∧ BelongsTo(x,y) ∧ Take(z,x) ∧ MakeSureDontSee(q,z) → evaluation(GOOD))	∀x∀y∀z(Food(y) ∧ BelongsTo(y,z) ∧ Takes(x,y) ∧ ¬SeesAnyoneElse(x) → evaluation(GOOD))	1			no one represented as existential with negated predicate	∀∃∧→¬∨	
7201	it's silly to engage in self-reflection if you find you enjoy using racial slurs.	∀x∀y∀z(RacialSlur(x) ∧ Use(y,x) ∧ SelfReflection(z) ∧ EngageIn(y,z) → evaluation(BAD))	∀x(UsesRacialSlurs(x) ∧ Enjoys(x, UsesRacialSlurs) ∧ SelfReflect(x) → evaluation(BAD))	3				∀∃∧→¬∨	
7202	you should go to the weddings of old friends.	∀x∀y∀z(OldFriendOf(x,y) ∧ WeddingOf(z,x) ∧ GoTo(y,x) → evaluation(GOOD))	∀x∀y∀z(Friends(y,x) ∧ Old(y) ∧ WeddingOf(z,x) ∧ GoesTo(y,z) → evaluation(GOOD))	3				∀∃∧→¬∨	
7203	it is bad to work on communication if you are having a hard time talking to your spouse.	∀x∀y∀z(SpouseOf(x,y) ∧ HasHardTimeTalkingTo(y,x) ∧ Communication(z) ∧ WorkOn(y,z) → evaluation(BAD))	∀x∀y(SpouseOf(y, x) ∧ HardTimeTalkingTo(x, y) ∧ WorksOn(x, COMMUNICATION) → evaluation(GOOD))	3				∀∃∧→¬∨	
7204	it's okay to try to game the system.	∀x∀y(System(x) ∧ TryToGame(y,x) → evaluation(GOOD))	∀x(TriesToGameSystem(x) → evaluation(GOOD))	3				∀∃∧→¬∨	
7205	it's okay to feel empty.	∀x(FeelEmpty(x) → evaluation(GOOD))	∀x(Feels(x, EMPTY) → evaluation(GOOD))	3				∀∃∧→¬∨	
7207	you shouldn't joke around with your family if it offends them.	∀x∀y(FamilyOf(x,y) ∧ OffendByJokingAround(x) ∧ JokeAroundWith(y,x) → evaluation(BAD))	∀x∀y∀z (JokesWith(x, y) ∧ FamilyOf(y, z) ∧ Offends(x, z) → evaluation(BAD))	1				∀∃∧→¬∨	
7208	you shouldn't remove channels you don't watch from your cable package.	∀x∀y∀z(Channel(x) ∧ ¬Watch(y,x) ∧ CablePackage(z) ∧ RemoveFrom(y,x,z) → evaluation(BAD))	∀x∀y(Channel(x) ∧ CablePackage(y) ∧ BelongsTo(x,y) ∧ ¬Watch(y,x) → evaluation(BAD))	1				∀∃∧→¬∨	
7209	you should not take jokes too far.	∀x∀y(Joke(x) ∧ TakeTooFar(y,x) → evaluation(BAD))	∀x∀y(Joke(x) ∧ TakesFar(y,x) → evaluation(BAD))	3				∀∃∧→¬∨	
7210	it's happy for someone to snitch on you.	∀x∀y(SnitchOn(x,y) → evaluation(GOOD))	∃x∀y(People(y) ∧ SnitchOn(y,x) → HappyFor(x) → evaluation(GOOD))	1				∀∃∧→¬∨	
7300	you should always pay off your student loans.	∀x∀y(StudentLoans(x) ∧ BelongsTo(x,y) ∧ PayOff(y,x) → evaluation(GOOD))	∀x∀y(BelongsTo(x,y) ∧ StudentLoan(x) ∧ AlwaysPaysOff(y,x) → evaluation(GOOD))	1				∀∃∧→¬∨	
7301	it's good to ask your teacher for help when you're worried you're going to fail.	∀x∀y(TeacherOf(x,y) ∧ WorriedGoingToFail(y) ∧ AshForHelp(y,x) → evaluation(GOOD))	∀x∀y(TeacherOf(y, x) ∧ Worried(x) ∧ BelievesSelfFailing(x) ∧ AsksHelpFrom(x, y) → evaluation(GOOD))	2				∀∃∧→¬∨	
7302	it's important to make time to visit with family	∀x∀y(Family(x) ∧ Time(y) ∧ MakeToVisit(z,y,x) → evaluation(GOOD))	∀x∀y(Family(y) ∧ MakesTimeFor(x, y) → evaluation(GOOD))	1				∀∃∧→¬∨	
7303	it's bad to cut out your best friend without explanation.	∀x∀y∀z(BestFriendOf(x,y) ∧ Explaination(z) ∧ CutOutWithout(y,x,z) → evaluation(BAD))	∀x∀y(Friend(y,x) ∧ Best(y,x) ∧ CutOut(x,y) ∧ ¬Explains(x,y,CUT_OUT) → evaluation(BAD))	2				∀∃∧→¬∨	
7304	it's fine to be apprehensive before an interview.	∀x∀y(Interview(x) ∧ ApprehensiveBefore(y,x) → evaluation(GOOD))	∀x∀y(Apprehensive(x) ∧ Before(x,y) ∧ Interview(y) → evaluation(GOOD))	3				∀∃∧→¬∨	
7305	it's expected that you attend a funeral as a final farewell to the deceased.	∀x∀y∀z(Funeral(x) ∧ Deseased(y) ∧ AttendAsFinalFarewellTo(z,x,y) → evaluation(GOOD))	∀x∀y(Deceased(y) ∧ FuneralOf(y,x) ∧ Attend(x,y) → evaluation(GOOD))	2				∀∃∧→¬∨	
7306	it's not ok if you don't want to go out with your colleagues.	∀x∀y(ColleagueOf(x,y) ∧ ¬WantToGoOutWith(y,x) → evaluation(BAD))	∀x(Colleague(x) ∧ ¬WantsToGoOutWith(YOU,x) → evaluation(BAD))	1				∀∃∧→¬∨	
7307	it is bad to put candy in your pocket if it is stolen.	∀x∀y∀z(Candy(x) ∧ Stolen(x) ∧ Pocket(z) ∧ BelongsTo(z,y) → evaluation(BAD))	∀x∀y(Candy(x) ∧ Pocket(y) ∧ PutsIn(x,y) ∧ Stolen(x) → evaluation(BAD))	1				∀∃∧→¬∨	
7308	if you have a test, you're not expected to be ready for it .	∀x∀y(Test(x) ∧ Have(y,x) ∧ ReadyFor(y,x) → evaluation(BAD))	∀x∀y(Test(x) ∧ Has(y,x) ∧ ¬ReadyFor(y,x) → evaluation(GOOD))	2			Opposite evaluation but same meaning	∀∃∧→¬∨	
7309	you should always help out your family with expenses.	∀x∀y∀z(Expences(x) ∧ FamilyOf(y,z) ∧ HelpOutWith(z,y,x) → evaluation(GOOD))	∀x∀y∀z(FamilyOf(y,x) ∧ Expense(z,y) ∧ HelpsOutWith(x,z) → evaluation(GOOD))	3				∀∃∧→¬∨	
7310	it's bad to share your feelings in appropriate places.	∀x∀y∀z(Feelings(x) ∧ BelongsTo(x,y) ∧ Place(z) ∧ Appropriate(z) ∧ ShareIn(y,x,z) → evaluation(BAD))	∀x∀y∀z(Feeling(y) ∧ BelongsTo(y,x) ∧ AppropriatePlace(z) ∧ SharedIn(x,y,z) → evaluation(GOOD))	1				∀∃∧→¬∨	
7400	it's not ok to indulge and live a little at night.	∀x(Indulge(x) ∧ LiveALittleAt(x,NIGHT) → evaluation(BAD))	∀x(IndulgesAtNight(x) ∧ LivesALittleAtNight(x) → evaluation(BAD))	3				∀∃∧→¬∨	
7401	it is good to be appreciative of discounts.	∀x∀y(Discount(x) ∧ AppreciativeOf(y,x) → evaluation(GOOD))	∀x∀y(Discount(x) ∧ AppreciativeOf(y,x) → evaluation(GOOD))	3				∀∃∧→¬∨	
7402	it's expected that you give your friend a special treat for her birthday.	∀x∀y∀z(Treat(x) ∧ Special(x) ∧ FriendOf(y,z) ∧ HasBirthday(y) ∧ GiveTo(z,x,y) → evaluation(GOOD))	∀x∀y∀z∀w(FriendOf(x,y) ∧ Treat(z) ∧ Special(z) ∧ BirthdayOf(w, y) ∧ Gives(x, z, w) → evaluation(GOOD))	3				∀∃∧→¬∨	
7403	it's best to confront a romantic partner with their behavior if they are abusive.	∀x∀y∀z(RomanticPartnerOf(x,y) ∧ Abusive(x) ∧ Behaviour(z) ∧ BelongsTo(z,x) ∧ ConfrontWith(y,x,z) → evaluation(GOOD))	∀x∀y(PartnerOf(x,y) ∧ Abusive(y) ∧ ConfrontsWithBehavior(x,y) → evaluation(GOOD))	3				∀∃∧→¬∨	
7404	you shouldn't always be careful when swimming in case a wave hits you.	∃x∃y(Swimming(x) ∧ WaveHits(x) ∧ Careful(x) → evaluation(BAD))	∀x∀y(People(x) ∧ Swimming(x) ∧ AlwaysBeCareful(x) → evaluation(BAD))	1				∀∃∧→¬∨	add wave conjunction
7405	you shouldn't return something that you stole to its owner.	∀x∀y∀z(Stole(x,y) ∧ Owns(z,y) ∧ ReturnTo(x,y,z) → evaluation(BAD))	∀x∀y∀z(Stole(y,x) ∧ OwnerOf(z,x) ∧ ReturnsTo(y,x,z) → evaluation(BAD))	3				∀∃∧→¬∨	
7406	it's normal to have a favorite.	∀x(HasFavorite(x) → evaluation(GOOD))	∀x∀y(Thing(x) ∧ Favours(y,x) → evaluation(GOOD))	2				∀∃∧→¬∨	
7407	you don't have to be aware of how things that don't seem like a big deal to you may be hurtful to others.	∀x∀y∃z(¬HaveToBeAwareOfHowMayBeHurfulTo(x,y,z) ∧ ¬SeemLikeBigDealTo(y,x) → evaluation(GOOD))	INVALID FOL: ∀x∀y∀z(Thing(z) ∧ NotBigDealTo(x,z) ∧ MayBeHurtfulTo(y,z) ∧ ¬AwareOf(x,y z) → evaluation(GOOD))	0				∀∃∧→¬∨	
7408	∀x(HarmByBiting(x,x) → evaluation(BAD))	∀x(HarmByBiting(x,x) → evaluation(BAD))	∀x(HarmByBiting(x,x) → evaluation(BAD))	3				∀∃∧→¬∨	
7409	you shouldn't shock your family.	∀x∀y(FamilyOf(x,y) ∧ Shock(y,x) → evaluation(BAD))	∀x∀y(FamilyOf(y,x) ∧ Shocks(x,y) → evaluation(BAD))	3				∀∃∧→¬∨	
7410	it's understandable if you use a customer's deposit to pay your shareholders' dividends.	∀x∀y∀z∀q∀r(Customer(x) ∧ Deposit(y) ∧ BelongsTo(y,x) ∧ Divident(z) ∧ Shareholder(q) ∧ BelongsTo(q,r) ∧ UseToPay(r,y,z) → evaluation(GOOD))	∀x∀y∀z(CustomersDeposit(x) ∧ Uses(y, x) ∧ ShareholdersDividends(z) ∧ Pay(y, z) → evaluation(BAD))	1				∀∃∧→¬∨	
7500	it's bad to get through college by cheating.	∀x∀y(College(y) ∧ GetThroughByCheating(x,y) → evaluation(BAD))	∀x∀y(College(x) ∧ Cheating(y) ∧ GetsThroughBy(x, y) → evaluation(BAD))	1				∀∃∧→¬∨	
7501	it's not understandable to laugh when someone's turned on by slime videos.	∀x∀y∀z(SlimeVideo(x) ∧ TurnedOnBy(y,x) ∧ Laugh(z) → evaluation(BAD))	∀x∀y(TurnedOnBy(y, SLIME_VIDEOS) ∧ LaughAt(x,y) → evaluation(BAD))	3				∀∃∧→¬∨	
7502	it is smart to double-check information before giving up.	∀x∀y(Information(x) ∧ DoubleCheckBeforeGivingUp(y,x) → evaluation(GOOD))	∀x∀y(DoubleCheck(x, y) ∧ Information(y) → evaluation(GOOD))	2			before	∀∃∧→¬∨	
7503	it's expected that you'll need to repurchase things you lose.	∀x∀y(Lose(x,y) ∧ Repurchase(x,y) → evaluation(GOOD))	∀x∀y(Thing(x) ∧ BelongsTo(x,y) ∧ Loses(y,x) → Repurchases(y,x)) → evaluation(GOOD)	1				∀∃∧→¬∨	
7504	it's ok to drive haphazardly when test driving a new car.	∀x∀y(Car(x) ∧ New(x) ∧ TestDrives(y,x) ∧ DrivesHaphazardly(y) → evaluation(GOOD))	∀x∀y(NewCar(x) ∧ TestDrive(y,x) ∧ DrivesHaphazardly(y) → evaluation(BAD))	1				∀∃∧→¬∨	
7505	it's polite to give too much criticism.	∀x∀y(Criticism(x) ∧ GiveTooMuch(y,x) → evaluation(GOOD))	∀x∀y(Gives(x, y, TOO_MUCH_CRITICISM) → evaluation(BAD))	1				∀∃∧→¬∨	
7506	you shouldn't date your ex.	∀x∀y(ExOf(x,y) ∧ Date(y,x) → evaluation(BAD))	∀x∀y(IsExOf(x,y) ∧ Dates(x,y) → evaluation(BAD))	3				∀∃∧→¬∨	
7507	it is rude to end other people's friendships.	∃x∀y∀z(FriendshipOf(y,x) ∧ End(z,y) → evaluation(BAD))	∀x∀y∀z∃w(People(x) ∧ People(y) ∧ Friends(y,z) ∧ People(w) ∧ EndFriendship(w,y,z) → evaluation(BAD))	1				∀∃∧→¬∨	
7508	if you love your job, you should quit it .	∀x∀y(Job(x) ∧ BelongsTo(x,y) ∧ Love(y,x) ∧ Quit(y,x) → evaluation(GOOD))	∀x∀y(JOB(y) ∧ BelongsTo(x, y) ∧ Loves(x, y) ∧ Quits(x, y) → evaluation(GOOD))	1				∀∃∧→¬∨	
7509	it is ok to think someone is hot.	∀x∀y(ThinkIsHot(x,y) → evaluation(GOOD))	INVALID FOL: ∀x∀y(People(x) ∧ People(y) ∧ Thinks(x, Hot(y)) → evaluation(GOOD))	0				∀∃∧→¬∨	
7510	it's proper to follow your daughter on her honeymoon.	∀x∀y∀z(DaughterOf(x,y) ∧ Honeymoon(z) ∧ BelongsTo(z,x) ∧ FollowOn(y,x,z) → evaluation(GOOD))	∀x∀y(DaughterOf(y,x) ∧ Follows(x,y) → evaluation(BAD))	1				∀∃∧→¬∨	
7600	it's bad to take your precious items with you when you go on trips.	∀x∀y∀z(Item(x) ∧ Precious(x) ∧ Trip(y) ∧ TakeWithOn(z,x,y) → evaluation(BAD))	∀x∀y(PreciousItem(x) ∧ BelongsTo(x,y) ∧ TakesWith(y,x) ∧ GoesOnTrips(y) → evaluation(BAD))	2				∀∃∧→¬∨	
7601	it's odd for parents to care about the well-being of their children.	∀x∀y(Parent(x) ∧ ChildOf(y,x) ∧ CareAboutWellBeingOf(x,y) → evaluation(BAD))	∀x∀y(ParentOf(x,y) ∧ CaresAboutWellBeing(x,y) → evaluation(GOOD))	1				∀∃∧→¬∨	
7602	it's unreasonable that your things will be safe in your own home.	∀x∀y∀z(BelongsTo(x,y) ∧ Home(z) ∧ BelongsTo(z,y) ∧ SafeIn(x,z) → evaluation(BAD))	∀x∀y∀z(Thing(x) ∧ BelongsTo(x,y) ∧ Safe(x,z) ∧ HomeOf(z,y) → evaluation(BAD))	2				∀∃∧→¬∨	
7603	you shouldn't charge people for water.	∀x∀y∀z(People(x) ∧ Water(y) ∧ ChargeFor(z,x,y) → evaluation(BAD))	∀x∀y(People(x) ∧ Water(y) ∧ ChargeFor(x,y) → evaluation(BAD))	1				∀∃∧→¬∨	
7604	it's wrong to keep expensive things another person gave you after splitting up.	∀x∀y∃z(Expensive(x) ∧ Gave(z,y,x) ∧ KeepAfterSplittingUpWith(y,x,z) → evaluation(BAD))	∀x∀y∀z∀w(Person(x) ∧ Person(y) ∧ ExpensiveThing(z) ∧ GaveTo(w,x,y) ∧ SplitUp(x,y) ∧ Keeps(w,z) → evaluation(BAD))	1				∀∃∧→¬∨	
7605	it's okay to mix up one person for another.	∃x∃y∀z(Person(x) ∧ Person(y) ∧ MixUpFor(z,x,y) → evaluation(GOOD))	∀x∀y∀z(People(x) ∧ People(y) ∧ Different(x,y) ∧ Confuses(z,x,y) → evaluation(GOOD))	3				∀∃∧→¬∨	
7606	you should put indoor plants near a window.	∀x∀y∀z(IndoorPlant(x) ∧ Window(y) ∧ PutNear(z,x,y) → evaluation(GOOD))	∀x∀y(IndoorPlant(x) ∧ Window(y) ∧ PutNear(x,y) → evaluation(GOOD))	3				∀∃∧→¬∨	
7607	it is wrong to betray the trust of your current partner by cheating.	∀x∀y(CurrentPartnerOf(x,y) ∧ BetrayTrustOfByCheating(y,x) → evaluation(BAD))	∀x∀y∀z(PartnerOf(x,y) ∧ Current(y) ∧ Trust(z,x,y) ∧ Cheats(x,y) → evaluation(BAD))	1				∀∃∧→¬∨	
7608	it's okay to have an opinion on a controversial topic	∀x∀y(Topic(x) ∧ Controversial(x) ∧ HaveOpinionOn(y,x) → evaluation(GOOD))	∀x∀y(Opinion(y) ∧ BelongsTo(y,x) ∧ ControversialTopic(x) → evaluation(GOOD))	1				∀∃∧→¬∨	
7609	it's boring to go swimming on a hot day.	∀x∀y(HotDay(x) ∧ GoesSwinningOn(y,x) → evaluation(BAD))	∀x∀y(Day(x) ∧ Hot(x) ∧ GoesSwimmingOn(y,x) → evaluation(BAD))	3				∀∃∧→¬∨	
7610	you should use your sibling's picture on your dating profiles.	∀x∀y∀z∀q(SiblingOf(x,y) ∧ Picture(z) ∧ BelongsTo(z,x) ∧ DatingProfile(q) ∧ BelongsTo(q,y) ∧ UseOn(y,z,q) → evaluation(GOOD))	∀x∀y∀z∀w(SiblingOf(y,x) ∧ PictureOf(z,y) ∧ DatingProfileOf(w,x) ∧ UsesOn(x,z,w) → evaluation(GOOD))	3				∀∃∧→¬∨	
7700	you shouldn't drive if your license is expired.	∀x∀y(License(x) ∧ Expired(x) ∧ BelongsTo(x,y) ∧ Drive(y) → evaluation(BAD))	∀x∀y(License(y) ∧ BelongsTo(y,x) ∧ Expired(y) ∧ Drives(x) → evaluation(BAD))	3				∀∃∧→¬∨	
7701	it is bad to plan in advance for a fun night out.	∀x∀y(NightOut(x) ∧ Fun(x) ∧ PlanInAdvance(y,x) → evaluation(BAD))	∀x∀y(Plans(x,y) ∧ NightOut(y) ∧ Fun(y) → evaluation(BAD))	2				∀∃∧→¬∨	
7702	it's good to talk to hr before you quit a job.	∀x∀y(Job(x) ∧ TalkToBeforeQuit(y,HR,x) → evaluation(GOOD))	∀x∀y(Job(y) ∧ PlansToQuit(x,y) ∧ TalksToBefore(x, HR, y) → evaluation(GOOD))	1				∀∃∧→¬∨	
7704	when you leave food out in the open, you shouldn't be surprised when animals get into it.	∀x∀y∀z(Food(x) ∧ LeaveOutInTheOpen(y,x) ∧ Surprised(y) ∧ Animal(z) ∧ GetTo(z,x) → evaluation(BAD))	∀x∀y∀z(Food(x) ∧ LeavesInOpen(z, x) ∧ Animal(y) ∧ GetsInto(y, x) → ¬Surprised(z) → evaluation(BAD))	1				∀∃∧→¬∨	
7705	it's not understandable to want to get out of doing things with our friends we don't enjoy.	∀x∀y∀z(WantToGetOutOfDoingWith(x,y,z) ∧ FriendsOf(z,x) ∧ ¬Enjoy(x,y) → evaluation(BAD))	∀x∀y∀z∀w(Thing(w) ∧ Friends(x,y) ∧ ¬Enjoy(y,w) ∧ WantToGetOutOfDoing(y,z,w) → evaluation(GOOD))	1			sentence can be interpreted as not enjoying the things or not enjoying the friends	∀∃∧→¬∨	
7706	it's bad to have feelings for others in life.	∀x∀y∃z(Feeling(x) ∧ HaveForIn(y,x,z,LIFE) → evaluation(BAD))	∀x∀y∃z(Life(y) ∧ In(x,y) ∧ People(z) ∧ HasFeelingsFor(x,z) → evaluation(BAD))	3				∀∃∧→¬∨	
7707	you should not explain to someone why if you want to leave them.	∀x∀y(ExplainWhyTo(x,y) ∧ WantToLeave(x,y) → evaluation(BAD))	∀x∀y(WantsToLeave(x, y) ∧ ¬ExplainsTo(x,y,WHY) → evaluation(GOOD))	3				∀∃∧→¬∨	
7708	it's normal to wonder about the afterlife	∀x(WonderAbout(x,AFTERLIFE) → evaluation(GOOD))	∀x(People(x) ∧ WonderAbout(x,AFTERLIFE) → evaluation(GOOD))	2				∀∃∧→¬∨	
7709	it is nice to tell somebody you love them	∀x∀y(TellLoveThem(x,y) → evaluation(GOOD))	∀x∀y(Somebody(y) ∧ Love(x,y) ∧ TellLove(x,y) → evaluation(GOOD))	3				∀∃∧→¬∨	
7710	it's fine to be hesitant about whether you're ready to adopt a child.	∀x∀y(HesitantAboutReadyToAdopt(x,y) ∧ Child(y) → evaluation(GOOD))	∀x∀y(Child(y) ∧ ¬ReadyToAdopt(x, y) ∧ HesitantAbout(x, y) → evaluation(GOOD))	1				∀∃∧→¬∨	
7800	it's unkind to pay for your spouse's movie ticket.	∀x∀y∀z(SpouseOf(x,y) ∧ MovieTicket(z) ∧ BelongsTo(z,x) ∧ PayFor(y,z) → evaluation(BAD))	∀x∀y∀z(SpouseOf(x,y) ∧ MovieTicket(z) ∧ PayFor(x,z) → evaluation(GOOD))	1				∀∃∧→¬∨	
7801	people should skirt their duties in the hopes that someone else will pick up the slack.	∀x∀y∃z(People(x) ∧ Duty(y) ∧ BelongsTo(y,x) ∧ HopesWillPickUp(x,z,y) ∧ Skirt(x,y) → evaluation(GOOD))	INVALID FOL: ∀x∃y∃z(People(x) ∧ Duties(z) ∧ BelongsTo(z, x) ∧ Skirt(x, z) ∧ Hope(x,WillPickUpSlack(y, z)) → evaluation(BAD))	0			Contradiction in 5500: people shouldn't skirt their duties in the hopes that someone else will pick up the slack.	∀∃∧→¬∨	
7802	it's bad to frame your awards to display them for others to see.	∀x∀y∃z(Award(x) ∧ BelongsTo(x,y) ∧ FrameToDisplayForToSee(y,x,z) → evaluation(BAD))	∀x∀y∀z(Award(x) ∧ Owns(y,x) ∧ Frames(y,x) ∧ See(z,x) → evaluation(BAD))	3				∀∃∧→¬∨	
7803	you should not fix your appliances if they are broken.	∀x∀y(Appliance(x) ∧ Broken(x) ∧ BelongsTo(x,y) ∧ Fix(y,x) → evaluation(BAD))	∀x∀y(Appliance(x) ∧ BelongsTo(x,y) ∧ Broken(x) ∧ Fixes(y,x) → evaluation(BAD))	3				∀∃∧→¬∨	
7804	it's good to ignore jeering and teasing.	∀x∀y∀z(Jeering(x) ∧ Teasing(y) ∧ Ignore(z,x) ∧ Ignore(z,y) → evaluation(GOOD))	∀x∀y((Jeering(x) ∨ Teasing(x)) ∧ Ignore(y,x) → evaluation(GOOD))	1				∀∃∧→¬∨	
7805	you shouldn't console your loved ones when they are upset.	∀x∀y(LovedOneOf(x,y) ∧ Upset(x) ∧ Console(y,x) → evaluation(BAD))	∀x∀y(LovedOnes(y,x) ∧ Upset(y) ∧ ¬Consoles(x,y) → evaluation(BAD))	1				∀∃∧→¬∨	
7806	it's ok to get off on other people's pain and heartbreak.	∀x∀y∃z∀q(Pain(x) ∧ Heartbreak(y) ∧ BelongsTo(x,z) ∧ BelongsTo(y,z) ∧ GetOffOn(q,x) ∧ GetOffOn(q,y) → evaluation(GOOD))	∀x∃y((Pain(y) ∨ Heartbreak(y)) ∧ GetsOffOn(x,y) → evaluation(GOOD))	3				∀∃∧→¬∨	
7807	it's thrifty to do home maintenance for oneself.	∀x∀y(HomeMaintenance(x) ∧ DoFor(x,y,x) → evaluation(GOOD))	∀x∀y(Home(y) ∧ Maintenance(y,x) ∧ Self(x) → evaluation(GOOD))	1				∀∃∧→¬∨	
7808	it's good to want to be able to express yourself.	∀x(WantToBeAbleToExpress(x,x) → evaluation(GOOD))	INVALID FOL: ∀x(Wants(x, AbilityToExpressOneself(x)) → evaluation(GOOD))	0				∀∃∧→¬∨	
7809	it's expected that family members support each other's milestone events.	∀x∀y∀z(MilestoneEvent(x) ∧ FamilyMemberOf(y,z) ∧ BelongsTo(x,y) ∧ Support(z,x) → evaluation(GOOD))	∀x∀y∀z(FamilyMember(x) ∧ FamilyMember(y) ∧ MilestoneEvent(z) ∧ BelongsTo(z, y) ∧ Supports(x,z) → evaluation(GOOD))	3			don't know if it captures 'each others'?	∀∃∧→¬∨	
7810	it's expected to be upfront about a potential problem coming in the near future.	∀x∀y(PotentialProblem(x) ∧ BeUpfrontAbout(y,x) ∧ ComesInNearFuture(x) → evaluation(GOOD))	∀x∀y(PotentialProblem(x) ∧ InNearFuture(x) ∧ UpfrontAbout(y,x) → evaluation(GOOD))	3				∀∃∧→¬∨	
7900	wearing a shirt under your sweater is smart in case you get hot.	∀x∀y∀z(Shirt(x) ∧ Sweater(y) ∧ BelongsTo(y,z) ∧ WearUnder(z,x,y) ∧ GetHot(z) → evaluation(GOOD))	∀x∀y∀z(Shirt(x) ∧ Sweater(y) ∧ WearsUnder(z, y, x) ∧ GetsHot(z) → evaluation(GOOD))	2				∀∃∧→¬∨	
7901	it's okay to get frustrated when you feel that a relationship is not equal.	∀x∀y(Relationship(x) ∧ FeelNotEqual(y,z) ∧ Frustrated(y) → evaluation(GOOD))	∀x∀y(Relationship(y) ∧ BelongsTo(y,x) ∧ ¬Equal(y) ∧ Feel(x,y) ∧ Frustrated(x) → evaluation(GOOD))	1				∀∃∧→¬∨	
7902	you should ask for others' inputs when you are facing a tough decision.	∀x∃y∀z∀q(Input(x) ∧ BelongsTo(x,y) ∧ AskFor(z,x) ∧ Decision(q) ∧ Tough(q) ∧ Face(z,q) → evaluation(GOOD))	∀x∀y∃z(Decision(x) ∧ Tough(x) ∧ Faces(y,x) ∧ People(z) ∧ AsksForInput(y,z) → evaluation(GOOD))	3				∀∃∧→¬∨	
7903	it is not ok to say what you like and what you don't	∀x∀y∀z(Like(x,y) ∧ ¬Like(x,z) ∧ Say(x,y) ∧ Say(x,y) → evaluation(BAD))	∀x∀y∀z(Likes(x,y) ∧ ¬Likes(x,z) ∧ SaysAboutLikesDislikes(x,y,z) → evaluation(BAD))	1			stupid sentence	∀∃∧→¬∨	
7904	it is ok to bite chocolate however you see fit.	∀x∀y∀z(Chocolate(x) ∧ WaySeeFit(y,z) ∧ BiteInWay(y,x,z) → evaluation(GOOD))	∀x∀y(Chocolate(x) ∧ SeesFitToBite(y,x) → evaluation(GOOD))	1				∀∃∧→¬∨	
