num	input_sequence	fol_translation	fol_adjustment-translation	fol_adjustment-eval	horn_translation	Analysis	comment	Symbols	
1618	you should dispose of your partner's bridesmaid at their wedding.	∀x∀y∀z∀q(BridesmaidOf(x,y) ∧ Wedding(z) ∧ PartnerOf(y,q) ∧ DisposeOfAt(q,x,y) → evaluation(GOOD))	∀x∀y∀z(PartnerOf(x,y) ∧ BridesmaidOf(z,y) ∧ AtWedding(z,y) ∧ DisposeOf(x,z) → evaluation(BAD))	3				∀∃∧→¬∨	
1619	it's good to fire people if they are not doing a good job.	∀x∀y(¬DoingGoodJob(x) ∧ Fire(y,x) → evaluation(GOOD))	∀x∀y(People(y) ∧ WorksFor(y, x) ∧ ¬DoesGoodJob(y) → (Fires(x, y) → evaluation(GOOD)))	1				∀∃∧→¬∨	
1620	it is understandable to want space when you are sick.	∀x∀y(Sick(x) ∧ WantSpace(x) → evaluation(GOOD))	∀x(Sick(x) ∧ WantsSpace(x) → evaluation(GOOD))	3				∀∃∧→¬∨	
1700	it's polite to be disrespectful of someone's religion.	∀x∀y∀z(ReligionOf(x,y) ∧ DisrespectfulOf(z,x) → evaluation(GOOD))	∀x∀y(DisrespectfulOfReligion(x,y) → evaluation(BAD))	1				∀∃∧→¬∨	
1701	it's understandable for parent's to use baby talk to their children.	∀x∀y(ChildOf(x,y) ∧ UsesTo(y,BABY_TALK,z) → evaluation(GOOD))	∀x∀y((Parent(x) ∧ Child(y) ∧ UsesBabyTalk(x,y)) → evaluation(GOOD))	3				∀∃∧→¬∨	
1702	it's bad to restrain your anger when you want to lash out at someone.	∀x∀y(WantsToLashOutAt(x,y) ∧ RestrainAnger(x) → evaluation(BAD))	∀x∀y∀z(Anger(y) ∧ BelongsTo(y,x) ∧ WantToLashOutAt(x,z) ∧ Restrains(x,y) → evaluation(BAD))	3				∀∃∧→¬∨	
1703	it's good to pay attention when things go wrong.	∀x∀y(PayAttention(x) ∧ GoWrong(y) → evaluation(GOOD))	∀x∀y(Thing(x) ∧ GoesWrong(x) ∧ PaysAttention(y,x) → evaluation(GOOD))	3				∀∃∧→¬∨	
1704	if you are hoping for a miracle, you should pray.	∀x(HopingForMiracle(x) ∧ Pray(x) → evaluation(GOOD))	∀x∀y(HopesFor(x,y) ∧ Miracle(y) ∧ Prays(x) → evaluation(GOOD))	3				∀∃∧→¬∨	
1705	it is not ok to be sad when your friend gets a partner.	∀x∀y(GetPartner(x) ∧ Friends(x,y) ∧ Sad(y) → evaluation(BAD))	∀x∀y∀z(Friends(x,y) ∧ HasPartner(y,z) ∧ Sad(x) → evaluation(BAD))	3				∀∃∧→¬∨	
1706	it's normal to be impolite to people who say offensive things.	∀x∀y(Thing(y) ∧ Offensive(y) ∧ Say(x,y) ∧ BeTowards(y,IMPOLITE,x) → evaluation(GOOD))	∀x∀y∀z(People(x) ∧ OffensiveThings(y) ∧ Says(z,y) ∧ ImpoliteTo(x,z) → evaluation(GOOD))	3				∀∃∧→¬∨	
1707	it's good to prioritize friendship over romantic entanglements.	∀x∀y∀z(Friendship(x,y) ∧ RomanticEntanglement(y,z) ∧ PrioritizeOver(z,x,y) → evaluation(GOOD))	∀x∀y∀z(Friends(x,y) ∧ RomanticEntanglement(x,z) ∧ Prioritize(x,y,z) → evaluation(GOOD))	3				∀∃∧→¬∨	
1708	you shouldn't be up front with people about why you are rejecting them as dates.	∀x∀y∀z(ReasonForToReject(x,y,z) ∧ UpfrontAboutTo(y,z,x) → evaluation(BAD))	∀x∀y∀z(People(z) ∧ Date(y) ∧ RejectedBy(x,y) ∧ UpFrontAbout(x,z) → evaluation(BAD))	1			reject about your own date not any date	∀∃∧→¬∨	
1709	you should not always take a lunch break at work even if you don't want to.	∀x∀y(LunchBreak(x) ∧ Take(y,x) ∧ (WantToTake(y,x) ∨ NotWantToTake(y,x)) → evaluation(BAD))	∀x∀y(Work(x) ∧ LunchBreak(y,x) ∧ ¬WantsToTakeBreak(x,y) → evaluation(GOOD))	1				∀∃∧→¬∨	
1710	it's not okay to let go of your health.	∀x∀y(HealthOf(x,y) ∧ LetGoOf(y,x) → evaluation(BAD))	∀x∀y(Health(y) ∧ BelongsTo(y,x) ∧ LetsGoOf(x,y) → evaluation(BAD))	3				∀∃∧→¬∨	
1800	you have no right to like whomever you find appealing.	∀x∀y(FindAppealing(x,y) ∧ Like(x,y) → evaluation(BAD))	∀x∀y(FindsAppealing(x,y) ∧ Likes(x,y) → evaluation(BAD))	3				∀∃∧→¬∨	
1801	it's okay to control people.	∀x∀y(Control(x,y) → evaluation(GOOD))	∀x∀y(People(y) ∧ Controls(x,y) → evaluation(GOOD))	3				∀∃∧→¬∨	
1802	it's bad to communicate well in a relationship	∀x∀y(Relationship(x,y) ∧ CommunicateWellIn(y,x) → evaluation(BAD))	∀x∀y(Relationship(x,y) ∧ CommunicatesWell(x,y) → evaluation(GOOD))	3				∀∃∧→¬∨	
1803	you should respect the space of others.	∀x∃y(RespectSpaceOf(x,y) → evaluation(GOOD))	∀x∀y(∃z(People(z) ∧ SpaceOf(y,z)) ∧ Respects(x,y) → evaluation(GOOD))	3				∀∃∧→¬∨	
1804	it's great to spend your money on things that set up you up to be more successful in the future	∀x∀y(SetsUpToBeMoreSuccessfulInFuture(x,y) ∧ SpendMoneyOn(y,x) → evaluation(GOOD))	∀x∀y∀z(Money(x) ∧ BelongsTo(x,y) ∧ Thing(z) ∧ SetsUpForSuccess(z,y) ∧ SpendOn(y,x,z) → evaluation(GOOD))	3				∀∃∧→¬∨	
1805	it's wrong to cheat on someone you are in a romantic relationship with.	∀x∀y(InRomanticRelationshipWith(x,y) ∧ CheatOn(x,y) → evaluation(BAD))	∀x∀y(RomanticRelationship(x, y) ∧ CheatsOn(x, y) → evaluation(BAD))	3				∀∃∧→¬∨	
1806	it is bad to celebrate fathers day with your kids.	∀x∀y(ChildOf(x,y) ∧ CelebrateWith(y,FATHERS_DAY,x) → evaluation(BAD))	∀x∀y∀z(ParentOf(x,y) ∧ Male(x) ∧ Kids(z) ∧ CelebratesWith(y,z) → evaluation(GOOD))	1			does not get "your" kids	∀∃∧→¬∨	
1807	if you survive a plane crash you are expected to be very grateful.	∀x∀y(PlaneCrash(x) ∧ Survive(y,x) ∧ VeryGrateful(y) → evaluation(GOOD))	∀x∀y(Survives(x,y) ∧ PlaneCrash(y) → Grateful(x)) → evaluation(GOOD)	3				∀∃∧→¬∨	
1808	it's encouraged to take charge of one's own nutritional needs.	∀x∀y(NutritionalNeedsOf(x,y) ∧ TakeChargeOf(y,x) → evaluation(GOOD))	INVALID FOL: ∀x(TakesChargeOf(x, NutritionalNeeds(x)) → evaluation(GOOD))	0				∀∃∧→¬∨	
1809	it's good to give a lesson on ending sexual harassment at school.	∀x∀y(GiveLessonOnAt(x,ENDING_SEXUAL_HARRASSMENT,SCHOOL) → evaluation(GOOD))	∀x∀y∀z(Teacher(x) ∧ Lesson(y) ∧ Gives(x,y) ∧ EndSexualHarassment(y) ∧ AtSchool(z) ∧ Located(y, z) → evaluation(GOOD))	2				∀∃∧→¬∨	
1810	it's bad to gloat about getting to do something unavailable for others to follow.	∀x∀y∃z(GloatAboutGettingToDo(x,y) ∧ ¬AvailableFor(y,z) → evaluation(BAD))	∀x∀y∀z(DoSomething(x,z) ∧ UnavailableForOthers(y,z) ∧ GloatAbout(x,z) → evaluation(BAD))	2				∀∃∧→¬∨	
1900	it's good to get a higher education in college.	∀x(GetEducationIn(x,COLLEGE) → evaluation(GOOD))	∀x∀y(College(y) ∧ Student(x) ∧ GetsHigherEducationIn(x, y) → evaluation(GOOD))	3				∀∃∧→¬∨	
1901	you should let a roommate invite family over without your permission.	∀x∀y∀z(RoommateOf(x,y) ∧ FamilyOf(z,x) ∧ InviteOver(x,z) ∧ ¬PermissionToInviteOver(x,y,z) → evaluation(GOOD))	∀x∀y∀z∀w(RoommateOf(x,y) ∧ FamilyOf(z,w) ∧ InvitesOverWithoutPermission(y,z,x) → evaluation(GOOD))	2				∀∃∧→¬∨	
1902	it's not noble to take care of many strays.	∀x(TakeCareOfMany(x,STRAY) → evaluation(BAD))	∀x∀y(Man(x) ∧ Many(y) ∧ Strays(y) ∧ TakesCareOf(x,y) → evaluation(GOOD))	2			not sure about the "many" 	∀∃∧→¬∨	
1903	it is irrational to be upset if a friend says you are not good at something you care about doing.	∀x∀y∀z(CaresAboutDoing(x,y) ∧ Friends(x,z) ∧ SaysIsNotGoodAt(z,x,y) ∧ Upset(x) → evaluation(BAD))	∀x∀y∀z(Friends(x,y) ∧ ¬GoodAt(y,z) ∧ CaresAbout(y,z) ∧ Upset(y) → evaluation(BAD))	1			not being good about something and being told you are not good about something are two different things	∀∃∧→¬∨	
1905	you should make fun of food workers.	∀x∀y(TypeOfWorker(x,FOOD) ∧ MakeFunOf(y,x) → evaluation(GOOD))	∀x∀y(FoodWorker(y) ∧ MakesFunOf(x,y) → evaluation(BAD))	3				∀∃∧→¬∨	
1906	it's bad to find strength in your religion.	∀x∀y(ReligionOf(x,y) ∧ FindStrengthIn(y,x) → evaluation(BAD))	∀x∀y(Religion(y) ∧ BelongsTo(y,x) ∧ FindStrengthIn(x,y) → evaluation(GOOD))	3				∀∃∧→¬∨	
1907	it is wrong to tell another person what to do.	∀x∃y(TellWhatToDo(x,y) → evaluation(BAD)	∀x∀y∀z(People(x) ∧ People(y) ∧ Different(x,y) ∧ TellWhatToDo(x,y) → evaluation(BAD))	3				∀∃∧→¬∨	
1908	it's acceptable to want things to be right.	∀x∀y(Thing(y) ∧ WantToBeRight(x,y) → evaluation(GOOD))	∀x(WantsThingsToBeRight(x) → evaluation(GOOD))	3				∀∃∧→¬∨	
1909	it's okay to feel down on yourself because of surgery scar.	∀x∀y(SurgeryScar(x) ∧ FeelDownOnSelfBecauseOf(y,x) → evaluation(GOOD))	∀x∀y(Scar(y) ∧ ResultOf(y, SURGERY) ∧ FeelsDownAbout(x, y) → evaluation(GOOD))	3				∀∃∧→¬∨	
1910	you should stay with someone you have nothing in common with.	∀x∀y(StayWith(x,y) ∧ ¬HaveSomethingInCommonWith(x,y) → evaluation(GOOD))	∀x∀y(StaysWith(x,y) ∧ ¬∃z(Common(x, y, z)) → evaluation(GOOD))	3				∀∃∧→¬∨	
2000	it's bad to demand that someone goes away.	∀x∀y(DemandToGoAway(x,y) → evaluation(BAD))	∀x∀y(Demands(x,y, GO_AWAY) → evaluation(BAD))	3				∀∃∧→¬∨	
2001	it's expected that you'll be respectful of your coworkers.	∀x∀y(Coworkers(x,y) ∧ RespectfulOf(x,y) → evaluation(GOOD))	∀x∀y(Coworkers(x,y) ∧ RespectfulOf(y,x) → evaluation(GOOD))	3				∀∃∧→¬∨	
2002	if you find something, you shouldn't attempt to find the owner .	∀x∀y(Find(x,y) ∧ AttemptToFindOwnerOf(x,y) → evaluation(BAD))	∀x∀y(Finds(x,y) ∧ ¬AttemptsToFindOwner(x,y) → evaluation(BAD))	1				∀∃∧→¬∨	
2003	you shouldn't expect your family to invite you to their wedding.	∀x∀y(FamilyMembers(x,y) ∧ ExpectToBeInvitedToWeddingOf(x,y) → evaluation(BAD))	∀x∀y∀z(FamilyOf(x,y) ∧ WeddingOf(z,x) ∧ ExpectsInvitation(y,z) → evaluation(BAD))	3				∀∃∧→¬∨	
2004	you shouldn't commit suicide because it hurts many people.	∀x∀x(Suicide(x) ∧ Commit(y,x) ∧ ActionHurtsManyPeople(x) → evaluation(BAD))	∀x∃y(Suicide(x) ∧ People(y) ∧ Hurts(x,y) → evaluation(BAD))	3				∀∃∧→¬∨	
2005	people shouldn't keep trying to find love despite rejections.	∀x(TryToFindLove(x) ∧ Rejected(x) → evaluation(BAD))	∀x(People(x) ∧ ∃y(Rejected(x,y) ∧ KeepTrying(x,y)) → evaluation(BAD))	2				∀∃∧→¬∨	
2006	it is not okay to do weird things when alone.	∀x∀y(Alone(x) ∧ DoWeirdThings(x) → evaluation(BAD))	∀x∀y(Thing(y) ∧ Weird(y) ∧ Alone(x) ∧ Does(x,y) → evaluation(BAD))	3				∀∃∧→¬∨	
2007	you are not allowed to cherish the lessons you were taught by others as important aspects of your character.	∀x∃y(Lesson(x) ∧ TaughtBy(y,x,z) ∧ CherishAsImportantAspectOfCharacter(y,x) → evaluation(BAD))	∀x∀y∀z(CharacterAspect(x, y) ∧ Lessons(z) ∧ TaughtTo(y,z) ∧ Cherish(y,z) → evaluation(BAD))	1			I am not sure about this one	∀∃∧→¬∨	
2008	people should freely give others their possessions when they no longer need them.	∀x∀x∃z(Owns(x,y) ∧ NoLongerNeeds(x,y) ∧ FreelyGiveTo(x,y,z) → evaluation(GOOD))	∀x∀y∃z(People(x) ∧ Possession(y) ∧ BelongsTo(y,x) ∧ ¬Need(x,y) ∧ People(z) ∧ GiveTo(x,z,y) → evaluation(GOOD))	3				∀∃∧→¬∨	
2009	it's boring to get into gardening and grow your own food.	∀x(GetInto(x,GARDENING) ∧ GrowOwnFood(x) → evaluation(BAD))	∀x∀y(Gardening(x) ∧ Food(y) ∧ GrowOwn(x,y) → evaluation(BAD))	1				∀∃∧→¬∨	
2010	it's ok to have too many possessions that you need additional rooms to keep them in.	∀x∀y(Possessions(x) ∧ HaveTooMany(y,x) ∧ NeedsAdditionalRoomsFor(yx) → evaluation(GOOD))	∀x∀y(Possessions(x) ∧ TooMany(x) ∧ NeedsAdditionalRoomsFor(y,x) → evaluation(GOOD))	3				∀∃∧→¬∨	
2100	you should be pissed at your family.	∀x∀y(FamilyOf(x,y) ∧ PissedAt(y,x) → evaluation(GOOD))	∀x∀y(FamilyOf(x,y) ∧ PissedAt(y,x) → evaluation(BAD))	3				∀∃∧→¬∨	
2101	it's okay to not provide for the people you care about.	∀x∀y(CareAbout(x,y) ∧ ¬ProvideFor(x,y) → evaluation(GOOD))	∀x∀y(People(y) ∧ CaresAbout(x,y) ∧ ¬ProvidesFor(x,y) → evaluation(GOOD))	3				∀∃∧→¬∨	
2102	you should talk to a professional if you need to when grieving.	∀x(Grieving(x) ∧ NeedToTalkToProfessional(x) ∧ TalkToProfessional(x) → evaluation(GOOD))	∀x∃y(Grieving(x) ∧ NeedsToTalkToProfessional(x) ∧ Professional(y) ∧ TalkTo(x,y) → evaluation(GOOD))	3				∀∃∧→¬∨	
2103	it's understandable to take time to reveal your crush on someone.	∀x∀y(Has(x,CRUSH,y) ∧ TakesTimeToReveal(x,CRUSH) → evaluation(GOOD))	∀x∀y(People(x) ∧ People(y) ∧ CrushOn(x,y) ∧ TakesTimeToReveal(x,y) → evaluation(GOOD))	3				∀∃∧→¬∨	
2104	it's okay to stop being friends with someone because they lost a job.	∀x∀y(StopBeingFriendsWith(x,y) ∧ LostJob(y) → evaluation(GOOD))	∀x∀y∀z(Friends(x,y) ∧ Job(z) ∧ Lost(y,z) ∧ StopBeingFriends(x,y) → evaluation(GOOD))	3				∀∃∧→¬∨	
2105	it's wrong to fantasize about married people.	∀x∀y(Married(x) ∧ FantasizeAbout(y,x) → evaluation(BAD))	∀x∀y(Married(x) ∧ FantasizeAbout(y,x) → evaluation(BAD))	3				∀∃∧→¬∨	
2106	if you can help a friend in any way, it's expected that you do, that's what good friends do.	∀x∀y∀z(Friends(x,y) ∧ CanHelpWith(x,y,z) ∧ HelpWith(x,y,z) → evaluation(GOOD))	∀x∀y∀z(People(x) ∧ Friends(x,y) ∧ AbleToHelp(x,y,z) → Help(x,y,z)) → evaluation(GOOD)	1				∀∃∧→¬∨	
2107	it's good to ask why people are in a hurry so you know what is wrong.	∀x∀y(AskWhyHurry(x,y) → evaluation(GOOD))	∀x∀y(People(x) ∧ InHurry(x) ∧ AskWhy(y,x) → evaluation(GOOD))	3				∀∃∧→¬∨	
2108	it's bad to adopt a child from another country.	∀x∀y∃z∀q(Child(x) ∧ Adopt(y,x) ∧ Fromcountry(x,z) ∧ Fromcountry(y,q) → evaluation(BAD))	∀x∀y∃z(Child(x) ∧ Country(z) ∧ From(x,z) ∧ Adopts(y,x) → evaluation(BAD))	3				∀∃∧→¬∨	
2109	it's bad to make amends for something you have done wrong to someone.	∀x∀y∀y(Wrong(x) ∧ HaveDoneTo(y,x,z) ∧ MakeAmendsFor(y,x) → evaluation(BAD))	∀x∀y∀z(DoneWrong(x, y, z) ∧ MakesAmendsFor(x, z) → evaluation(GOOD))	3				∀∃∧→¬∨	
2110	you're expected to try to keep yourself emotionally healthy.	∀x(KeepEmotionallyHealthy(x) → evaluation(GOOD))	∀x(Same(x, YOU) ∧ Try(x) ∧ KeepEmotionallyHealthy(x) → evaluation(GOOD))	1				∀∃∧→¬∨	
2200	it's polite to tease someone who doesn't understand what cake day is.	∀x∀y∀z(CakeDay(z) ∧ ¬Understand(x,z) ∧ Tease(y,x) → evaluation(GOOD))	∀x∀y∀z(People(x) ∧ People(y) ∧ CakeDay(z) ∧ ¬Understand(y,z) ∧ Tease(x,y) → evaluation(GOOD))	3				∀∃∧→¬∨	
2201	it's not rude to report a friend to the police for a crime they didn't commit.	∀x∀y∀z∀q(Crime(x) ∧ ¬Commit(y,x) ∧ Police(z) ∧ ReportToFor(q,y,z,x) → evaluation(GOOD))	∀x∀y∀z(Friends(x,y) ∧ Police(z) ∧ ¬CommitCrime(y) ∧ ReportTo(x,z,y) → evaluation(BAD))	1				∀∃∧→¬∨	
2202	it is insensitive to ignore the anniversary of a death.	∀x∀y∀z(Death(x) ∧ AnniversaryFor(y,x) ∧ Ignore(z,y) → evaluation(BAD))	∀x∀y(AnniversaryOf(x, DEATH) ∧ Ignore(y,x) → evaluation(BAD))	2				∀∃∧→¬∨	
2203	you should not look into nose strips when you snore.	∀x∀y(Snore(x) ∧ NoseStrips(y) ∧ LookInto(x,y) → evaluation(BAD))	∀x(Snores(x) ∧ LooksInto(x, NOSE_STRIPS) → evaluation(GOOD))	3				∀∃∧→¬∨	
2204	it's wrong to be late in meeting someone if you have a good reason.	∀x∀y∀z(LateInMeeting(x,y,z) ∧ GoodReason(z)  → evaluation(BAD))	∀x∀y∀z(GoodReason(z) ∧ BelongsTo(z,x) ∧ MeetsSomeone(x,y) ∧ LateForMeeting(x,y) → evaluation(BAD))	1			the good reason is not attached to being late for the meeting	∀∃∧→¬∨	
2205	you should not always punish people for their wrongdoings.	∃x∃y∃z(WrongDoingsOf(x,y) ∧ PunishFor(z,x,y) → evaluation(BAD))	∀x∀y(People(x) ∧ Wrongdoing(y) ∧ Committed(x,y) ∧ ¬AlwaysPunish(x,y) → evaluation(GOOD))	3				∀∃∧→¬∨	
2206	it's considerate to expect an apology when your friend pays for a new phone.	∀x∀y∀z(Phone(x) ∧ New(x) ∧ PaysFor(y,x) ∧ Friends(z,y) ∧ ExpectApology(z) → evaluation(GOOD))	∀x∀y∀z(FriendOf(x,y) ∧ Phone(z) ∧ New(z) ∧ PaysFor(y,z) → Expects(x, APOLOGY)) → evaluation(GOOD)	3				∀∃∧→¬∨	
2207	it's allowed to exclude some people for a private get-together in the woods.	∀x∀y∃z(PrivateGetTogetherInTheWoods(x) ∧ ExcludeFor(y,z,x) → evaluation(GOOD))	∃x∀y∃z(GetTogether(x) ∧ Private(x) ∧ InWoods(x) ∧ People(y) ∧ Excludes(x, y) → evaluation(GOOD))	3				∀∃∧→¬∨	
2208	it's understandable to feel bad if someone doesn't want to talk to you any more.	∀x∀y(¬WantToTalkToAnymore(x,y) ∧ FeelBad(y) → evaluation(GOOD))	∀x∃y(Person(x) ∧ Person(y) ∧ ¬WantsToTalkTo(y,x) ∧ Feels(x,BAD) → evaluation(GOOD))	3				∀∃∧→¬∨	
2209	it is expected kids will walk with their parents.	∀x∀y(ParentOf(x,y) ∧ Child(y) ∧ WillWalkWith(y,x) → evaluation(GOOD))	∀x∀y(Kid(x) ∧ Parents(y) ∧ WalksWith(x,y) → evaluation(GOOD))	3				∀∃∧→¬∨	
2210	it's good to teach your students how to tip.	∀x∀y(StudentOf(x,y) ∧ Teach(y,x,TIPPING) → evaluation(GOOD))	∀x∀y∀z(Student(y,x) ∧ TeachTipping(x,y,z) → evaluation(GOOD))	3				∀∃∧→¬∨	
2300	you shouldn't be with someone you can't get along with.	∀x∀y(BeWith(x,y) ∧ ¬AbleToGetAlongWith(x,y) → evaluation(BAD))	∀x∃y(Person(x) ∧ Person(y) ∧ With(x, y) ∧ ¬GetAlongWith(x,y) → evaluation(BAD))	3			the existential quantifier	∀∃∧→¬∨	
2301	it's not rude to be in someone's room if they're changing their clothes.	∀x∀y∀z(Room(x) ∧ BelongsTo(x,y) ∧ IsIn(z,x) ∧ ChangingClothes(y) → evaluation(GOOD))	∀x∀y∀z((Person(x) ∧ Room(y) ∧ In(x,y) ∧ ChangingClothes(z) ∧ In(z,y)) → evaluation(BAD))	1				∀∃∧→¬∨	
2302	it's not expected that you talk bout love in private.	∀x(TalkAboutInPrivate(x,LOVE) → evaluation(BAD))	∀x∀y(TalkAbout(x,y,LOVE) ∧ InPrivate(x) → evaluation(GOOD))	1				∀∃∧→¬∨	
2303	it's irrational that women wear bras in public.	∀x∀y(Woman(x) ∧ Bra(y) ∧ WearInPublic(x,y) → evaluation(BAD))	∀x∀y(Woman(x) ∧ Bra(y) ∧ WearsInPublic(x,y) → evaluation(BAD))	3				∀∃∧→¬∨	
2304	you shouldn't take care of your baby when it's sick.	∀x∀y(Baby(x) ∧ BelongsTo(y,x) ∧ TakeCareOf(y,x) ∧ Sick(x) → evaluation(BAD))	∀x∀y(Baby(y) ∧ BelongsTo(y,x) ∧ Sick(y) ∧ ¬TakesCareOf(x,y) → evaluation(BAD))	1				∀∃∧→¬∨	
2305	it's bad to ask people to show you some respect.	∀x∀y(AskToShowRespectTo(x,y,x) → evaluation(BAD))	∀x∀y(People(x) ∧ Asks(y,x, RESPECT) → evaluation(BAD))	3				∀∃∧→¬∨	
2306	it is rude to keep important secrets from people	∀x∀y∀z(Secret(x) ∧ Important(x) ∧ KeepFrom(y,x,z) → evaluation(BAD))	∀x∀y(Secret(x) ∧ Important(x) ∧ People(y) ∧ KeepsFrom(y,x) → evaluation(BAD))	3				∀∃∧→¬∨	
2307	it's not okay to feel conflicted about your sexual identity.	∀x∀y∀z(SexualIdentifyOf(x,y) ∧ FeelConflictedAbout(y,x) → evaluation(BAD))	∀x(SexualIdentity(x) ∧ ConflictedAbout(y,x) → evaluation(BAD))	3				∀∃∧→¬∨	
2308	it is unexpected that some people grow up skiing for fun.	∀x∃y(Skiing(x) ∧ GrowUpDoingForFun(y,x) → evaluation(BAD))	∃x∃y(People(x) ∧ Skiing(y) ∧ ForFun(y) ∧ GrowsUpDoing(x,y) → evaluation(BAD))	3				∀∃∧→¬∨	
2309	if you need something expensive you are not expected to work for it and earn the money youself.	∀x∀y(Expensive(x) ∧ Need(y,x) ∧ WorkFor(y,x) ∧ EarnMoneyFor(y,x) → evaluation(BAD))	∀x∀y(Needs(x,y) ∧ Expensive(y) ∧ ¬(WorksForAndEarns(x, y)) → evaluation(GOOD))	2				∀∃∧→¬∨	
2310	it's understandable to be upset when there's no work to do.	∀x(¬WorkToDoFor(x) ∧ Upset(x) → evaluation(GOOD))	∀x∀y(Work(y) ∧ ¬Exist(y) ∧ Upset(x) → evaluation(GOOD))	1			the exist predicate	∀∃∧→¬∨	
2401	it's not frowned upon for people to continue a relationship with a former romantic interest when they've moved on to other relationships.	∀x∀y∀z∃q(People(x) ∧ FormerRomanticInterestOf(y,x) ∧ ContinueRelationshipWith(x,y) ∧ MovedOnToRelationship(x,q) → evaluation(GOOD))	∀x∀y∀z∃v(People(x) ∧ PastRomanticInterest(y,x) ∧ CurrentRelationship(x,z) ∧ OtherRelationships(v,x) ∧ ContinuesWith(x,y) → evaluation(GOOD))	2			Long predicates...	∀∃∧→¬∨	
2402	you should savor the food you order when it is authentic.	∀x∀y(Food(x) ∧ Authentic(x) ∧ Savour(y,x) → evaluation(GOOD))	∀x∀y(Ordered(y,x) ∧ Food(x) ∧ Authentic(x) ∧ Savors(y,x) → evaluation(GOOD))	3				∀∃∧→¬∨	
2403	it's not ok to doubt if thing will ever go well for you when you're having a bad time.	∀x∀y(DoubtingThingsWillGoWell(x) ∧ HaveBadTime(x) → evaluation(BAD))	∀x∀y(BadTime(x) ∧ Things(y) ∧ ¬WillGoWellFor(y,x) ∧ Doubts(x,y) → evaluation(BAD))	1			no agent	∀∃∧→¬∨	
2404	it's good to wish misfortune on others.	∀x∃y(WishMisfortuneOn(x,y) → evaluation(GOOD))	∀x∀y∃z(WishesMisfortuneOn(x,z) ∧ People(z) ∧ NotSame(x,z) → evaluation(BAD))	1				∀∃∧→¬∨	
2405	it's okay to feel confused when your parents teach you to break the rules.	∀x∀y∀z(Rules(x) ∧ TeachToBreak(y,z,x) ∧ ParentsOf(y,z) ∧ Confused(z) → evaluation(GOOD))	∀x∀y∀z(ParentsOf(y,x) ∧ Rules(z) ∧ TeachToBreak(y,x,z) ∧ Feels(x, CONFUSED) → evaluation(GOOD))	3				∀∃∧→¬∨	
2406	you should leave dog poop where people can step in it.	∀x∀y∀z∀q(DogPoop(x) ∧ PlaceWhereTheyStep(z,y) ∧ People(y) ∧ LeaveAt(q,x,z) → evaluation(GOOD))	∀x∀y∃z(DogPoop(x) ∧ People(y) ∧ CanStepIn(y,z,x) → evaluation(GOOD))	1			the leaving of poop is missing	∀∃∧→¬∨	
2407	it's rude to exclude the people close to you from activities.	∀x∀y∀z(People(x) ∧ CloseTo(x,y) ∧ Activities(z) ∧ ExcludeFrom(y,x,z) → evaluation(BAD))	∀x∀y∀z(People(y) ∧ CloseTo(x,y) ∧ Activity(z) ∧ Excludes(x,y,z) → evaluation(BAD))	3				∀∃∧→¬∨	
2408	it is understandable to want a break from life.	∀x(WantABreakFrom(x,LIFE) → evaluation(GOOD))	∀x(Wants(x, BREAK_FROM_LIFE) → evaluation(GOOD))	3				∀∃∧→¬∨	
2409	you should be careful when driving so you don't hit a motorcyclist.	∀x∀y(Driving(x) ∧ Careful(x) ∧ Motorcyclist(y) ∧ ¬Hit(x,y) → evaluation(GOOD))	∀x∀y(Driving(x) ∧ Motorcyclist(y) → BeCareful(x,y) → evaluation(GOOD))	1				∀∃∧→¬∨	
2410	it's okay for girls to be involved in physical sports	∀x∀y(Girl(x) ∧ Sport(y) ∧ Physical(y) ∧ InvolvedIn(x,y) → evaluation(GOOD))	∀x∀y(Girl(x) ∧ PhysicalSport(y) ∧ InvolvedIn(x,y) → evaluation(GOOD))	3				∀∃∧→¬∨	
2500	it is not normal for kids to beg their parents for sweets.	∀x∀y∀z(Kid(x) ∧ ParentOf(y,x) ∧ Sweets(z) ∧ BegFor(x,y,z) → evaluation(BAD))	∀x∀y∀z(Kid(x) ∧ Parent(y) ∧ Sweet(z) ∧ BegFor(x,y,z) → evaluation(BAD))	3				∀∃∧→¬∨	
2501	you should talk with your friend before you break it off.	∀x∀y(Friend(x,y) ∧ TalkToBeforeBreakingOf(x,y) → evaluation(GOOD))	∀x∀y(Friends(x,y) ∧ PlanBreakOff(x,y) → TalksTo(x,y) → evaluation(GOOD))	1			Long predicate, how to include 'before'	∀∃∧→¬∨	
2502	it's expected that people will report wrongdoing to the proper authorities.	∀x∀y∀z(WrongDoings(x) ∧ People(y) ∧ ProperAuthority(z) ∧ ReportTo(y,x,z) → evaluation(GOOD))	∀x∀y∀z(People(x) ∧ Wrongdoing(y) ∧ ProperAuthorities(z) ∧ ReportsTo(x,y,z) → evaluation(GOOD))	3				∀∃∧→¬∨	
2503	it is reasonable to be unhappy even if you are making a lot of money.	∀x∀y∀z((MakeAlotOfMoney(x) ∨ ¬MakeAlotOfMoney(x)) ∧ Unhappy(x) → evaluation(GOOD))	∀x(MakingMoney(x) ∧ Unhappy(x) → evaluation(GOOD))	3				∀∃∧→¬∨	
2504	it's irrational to not do someone a favor that's asking too much.	∀x∀y∀z(Favor(x) ∧ AsksTooMuch(x) ∧ ¬DoFor(y,x,z) → evaluation(BAD))	∀x∀y(AskingFavor(y,x) ∧ TooMuch(x) ∧ ¬DoFavor(y,x) → evaluation(GOOD))	3				∀∃∧→¬∨	
2505	it's not okay if you stop caring about someone just because you have a better situation in life.	∀x∀y∀z(StopCaringAbout(x,y) ∧ BetterSituationInLife(z) ∧ Have(x,z) → evaluation(BAD))	∀x∀y∀z(CaresAbout(x,y) ∧ BetterSituation(x,z) ∧ ¬CaresAboutAfter(x,y,z) → evaluation(BAD))	2			"just because..."	∀∃∧→¬∨	
2506	if you're selling something you're expected to be fair.	∀x∀y(Selling(x,y) ∧ Fair(x) → evaluation(GOOD))	∀x∀y∀z(People(x) ∧ Thing(y) ∧ Sell(x,y) → Fair(x) → evaluation(GOOD))	1				∀∃∧→¬∨	
2507	you shouldn't be understanding when your spouse thinks you're up to something.	∀x∀y∀z(ThinkUpTo(x,y,z) ∧ Spouse(x,y) ∧ Understanding(y) → evaluation(BAD))	INVALID FOL: ∀x∀y(SpouseOf(x,y) ∧ Thinks(y,UpToSomething(x)) ∧ Understanding(x) → evaluation(BAD))	0				∀∃∧→¬∨	
2508	one is not expected to be able to trust their romantic partners.	∀x∀y(RomanticPartner(x,y) ∧ AbleToTrust(y,x) → evaluation(BAD))	∀x∀y(RomanticPartnerOf(x,y) ∧ Trust(x,y) → evaluation(BAD))	3				∀∃∧→¬∨	
