num	input_sequence	fol_translation	fol_adjustment-translation	fol_adjustment-eval	horn_translation	Analysis	comment	Symbols	
0	you should expect your friends to reveal everything about themselves to you.	∀x∀y∀z(Friends(x,y) ∧ ExpectToReveal(x,y,z) ∧ About(z,y) → evaluation(GOOD))	∀x∀y(Friends(x,y) ∧ ∀z(SelfRevealing(y,z) → evaluation(GOOD)))	2	¬Friends(x,y) ∨ ¬ExpectToRevealEverything(x,y) ∨ evaluation(GOOD)		Comment colour codes: Emma Luca 	∀∃∧→¬∨	
1	you should ask too much of your family.	∀x∀y(Family(x,y) ∧ AskTooMuch(y,x) → evaluation(GOOD))	∀x∀y(FamilyOf(y,x) ∧ AsksTooMuch(x,y) → evaluation(BAD))	1	¬Family(x,y) ∨ ¬ShouldAskTooMuch(y,x) ∨ evaluation(GOOD)		Solved	∀∃∧→¬∨	
2	it's good to meet new people when you go shopping.	∀x∀y(GoesShopping(x) ∧ Meets(x,y) ∧ NewPeople(y) → evaluation(GOOD))	∀x∀y∃z(GoesShopping(x) ∧ People(y) ∧ New(y) ∧ Meet(x,y) → evaluation(GOOD))	2	¬GoShopping(x) ∨ ¬Meets(x,y) ∨ ¬NewPeople(y) ∨ evlauation(GOOD)		Guidelines	∀∃∧→¬∨	
3	it's good to be excited about getting your first paycheck.	∀x∀y(FirstPaycheck(x) ∧ Gets(y,x) ∧ ExcitedAbout(y,x) → evaluation(GOOD))	∀x∀y(FirstPaycheck(y) ∧ BelongsTo(y,x) ∧ ExcitedAbout(x,y) → evaluation(GOOD))	3	¬FirstPaycheck(x) ∨ ¬Gets(y,x) ∨ ¬ExcitedAbout(y,x) ∨ evluation(GOOD)			∀∃∧→¬∨	
4	you're expected to make sure food you serve to others is safe to eat.	∀x∀y∃z(IsFood(x) ∧ Serve(y,x,z) ∧ AssureSafeToEat(y,x) → evaluation(GOOD))	∀x∀y∀z(ServesTo(x,y,z) ∧ Food(z) → SafeToEat(z) → evaluation(GOOD))	1	¬IsFood(x) ∨ ¬Serve(y,x,z) ∨ ¬AssureSafeToEat(y,x) ∨ evaluation(EXPECTED)			∀∃∧→¬∨	
5	it's bad to take an advantage in life when you see it.	∀x∀y(AdvantageInLife(x) ∧ See(y,x) ∧ Take(y,x) → evaluation(BAD))	∀x∀y(Sees(x,y) ∧ AdvantageInLife(y) ∧ Takes(x,y) → evaluation(BAD))	3	¬AdvantageInLife(x) ∨ ¬See(y,x) ∨ ¬Take(y,x) ∨ evaluation(BAD)			∀∃∧→¬∨	
6	you shouldn't try to steal your friend's significant other	∀x∀y∀z(Friend(y,x) ∧ SignificantOther(z,y) ∧ TryToSteal(x,z) → evaluation(BAD))	∀x∀y∀z(Friends(x,y) ∧ HasSignificantOther(y,z) ∧ TriesToSteal(x,z) → evaluation(BAD))	3	¬Friend(y,x) ∨ ¬SignificantOther(z,y) ∨ ¬TryToSteal(x,z) ∨ evaluation(BAD)			∀∃∧→¬∨	
7	you shouldn't measure new furniture before buying.	∀x∀y(NewFurniture(x) ∧ ¬Bought(y,x) ∧ Measure(y,x) → evaluation(BAD))	∀x∀y(Furniture(x) ∧ New(x) ∧ Buys(y,x) ∧ ¬MeasuresBefore(y,x) → evaluation(BAD))	1	INVALID HORN			∀∃∧→¬∨	
8	it's bad to get free driving lessons if you want to learn how to drive.	∀x(WantToLearnDriving(x) ∧ GetsFreeDrivingLessons(x) → evaluation(BAD))	∀x∀y(WantsToLearn(x, DRIVE) ∧ FreeDrivingLesson(y) ∧ Gets(x, y) → evaluation(BAD))	3	¬WantToLearnDriving(x) ∨ ¬GetsFreeDrivingLessons(x) ∨ evaluation(BAD)			∀∃∧→¬∨	
9	it's considered uncivilized to live in a van.	∀x∀y(Van(x) ∧ LivesIn(y,x) → evaluation(BAD))	∀x(LivesIn(x, VAN) → evaluation(BAD))	3	¬LivesInVan(x) ∨ evaluation(UNCIVILIZED)			∀∃∧→¬∨	
10	people are not expected to love their family.	∀x∀y(People(x) ∧ Family(x,y) ∧ Love(x,y) → evaluation(BAD))	∀x∀y(FamilyOf(y,x) ∧ Loves(x,y) → evaluation(GOOD))	1	INVALID HORN			∀∃∧→¬∨	
100	it's good to take care and do nice things for yourself.	∀x(TakeCare(x,x) ∧ DoNiceThingsFor(x,x) → evaluation(GOOD))	∀x∀y(TakeCareOf(x, x) ∧ NiceThing(y) ∧ DoFor(x, y) → evaluation(GOOD))	2	¬TakeCare(x,x) ∨ ¬DoNiceThingsFor(x,x) ∨ evaluation(GOOD)			∀∃∧→¬∨	
101	it's okay to have doubts about your employers programs.	∀x∀y∀z(Program(x) ∧ Doubts(y,x) ∧ Employer(z,y) ∧ Owns(z,x) → evaluation(GOOD))	∀x∀y(Employer(x) ∧ Program(y) ∧ BelongsTo(y,x) ∧ HasDoubtsAbout(YOU, y) → evaluation(GOOD))	1	¬Program(x) ∨ ¬Doubts(y,x) ∨ ¬Employer(z,y) ∨ ¬Owns(z,x) ∨ evaluation(GOOD)		Alternative FOL translation: ∀x∀y(EmployersProgram(x) ∧ Doubts(y,x) → evaluation(okay)) ??	∀∃∧→¬∨	
102	it's fun to hire a tour guide to learn about new places.	∀x∀y∀z((TourGuide(x) ∧ NewPlaces(y) ∧ Hire(z,x) ∧ LearnAbout(z,y)) → evaluation(GOOD))	∀x∀y∀z(TourGuide(x) ∧ Hires(y,x) ∧ NewPlaces(z) ∧ LearnAbout(y,z) → evaluation(GOOD))	3	¬TourGuide(x) ∨ ¬ NewPlaces(y) ∨ ¬Hire(z,x) ∨ ¬LearnAbout(z,y) ∨ evaluation(FUN)	Does not take "to..." into consideration		∀∃∧→¬∨	
103	it's good to go out camping with your buddies.	∀x∀y(Buddy(x,y) ∧ GoesCampingWith(x,y) → evaluation(GOOD))	∀x∀y∀z(Buddies(x,y) ∧ Outdoors(z) ∧ GoCampingWith(x,y,z) → evaluation(GOOD))	3	¬Buddy(x,y) ∨ ¬GoesCampingWith(x,y) ∨ evaluation(GOOD)			∀∃∧→¬∨	
104	people should date others based solely on their age.	∀x∃y(People(x) ∧ People(y) ∧ DateBasedOnAge(x,y) → evaluation(GOOD))	∀x∀y∀z(People(x) ∧ People(z) ∧ AgeOf(y,z) ∧ DateBasedOn(x,z,y) → evaluation(GOOD))	2	¬People(x) ∨ ¬People(y) ∨ ¬DateBasedOnAge(x,y) ∨ evaluation(GOOD)			∀∃∧→¬∨	
105	you should sleep around if you don't want an std.	∀x∀y(STD(y) ∧ ¬Want(x,y) ∧ SleepAround(x) → evaluation(GOOD))	∀x(SleepsAround(x) ∧ ¬Wants(x, STD) → evaluation(BAD))	1	(evaluation(GOOD) ∨ ¬WantSTD(x)) ∧ (evaluation(GOOD) ∨ ¬SleepAround(x))			∀∃∧→¬∨	
106	you should not always get registration information when in an accident	∃y∃x∃z(Accident(x) ∧ In(y,x) ∧ RegistrationInfo(z) ∧ Get(y,z) → evaluation(BAD))	INVALID FOL: ∀x∀y(Accident(x) ∧ In(y, x) ∧ Always(Get(y, RegistrationInformation(x))) → evaluation(BAD))	0				∀∃∧→¬∨	
107	people should root for the success of their friends' relationships.	∀x∀y∀z(People(x) ∧ Friends(x,y) ∧ HasRelationship(y,z) ∧ RootFor(x,z) → evaluation(GOOD))	∀x∀y∀z(People(x) ∧ Friends(y,x) ∧ Relationship(z,y) ∧ RootForSuccessOf(x,z) → evaluation(GOOD))	3	¬People(x) ∨ ¬Friends(x,y) ∨ ¬HasRelationship(y,z) ∨ ¬RootFor(x,z) ∨ evaluation(GOOD)			∀∃∧→¬∨	
108	getting circumcised isn't normal.	∀x(GettingCircumcised(x) → evaluation(BAD))	∀x(Circumcised(x) ∧ ¬Normal(x) → evaluation(BAD))	1	¬GettingCircumcised(x) ∨ evaluation(NOT_NORMAL)			∀∃∧→¬∨	
109	it's not ok to be frustrated when you work on amazon mechanical turk.	∀x(WorksOn(x,AMAZONMECHANICALTURK) ∧ Frustrated(x) → evaluation(BAD))	∀x(WorksOn(x, AMAZON_MECHANICAL_TURK) ∧ Frustrated(x) → evaluation(BAD))	3	¬WorksOn(x,AMAZONMECHANICALTURK) ∨ ¬Frustrated(x) ∨ evaluation(BAD)			∀∃∧→¬∨	
110	it's bad for your health scare to be averted.	∀x(HealthScare(x) ∧ Averted(x) → evaluation(BAD))	∀x∀y(HealthScare(x) ∧ BelongsTo(x,y) ∧ Averted(x) → evaluation(GOOD))	1	¬HealthScare(x) ∨ ¬Averted(x) ∨ evaluation(BAD)			∀∃∧→¬∨	
200	it is bad to support a friend staying quit from smoking.	∀x∀y(Friend(x,y) ∧ StayingQuitFromSmoking(y) ∧ Support(x,y) → evaluation(BAD))	∀x∀y(Friend(x,y) ∧ QuidSmoking(y) ∧ Supports(x,y) → evaluation(GOOD))	1	¬Friend(x,y) ∨ ¬StayingQuitFromSmoking(y) ∨ ¬Support(x,y) ∨ evaluation(BAD)			∀∃∧→¬∨	
201	it's wrong to single someone out based on their race.	∀x∀y∀z(SingleOutBasedOn(x,z,y) ∧ Race(y)) → evaluation(BAD)	∀x∀y∃z(People(x) ∧ RaceAttribute(y,z) ∧ SinglesOutBasedOn(x,z) → evaluation(BAD))	2	¬SingleOutBasedOn(x,z,y) ∨ ¬Race(y) ∨ evaluation(BAD)			∀∃∧→¬∨	
202	you shouldn't get help if your anxiety is interfering with your daily life	∀x∀y(Anxiety(x) ∧ InterfereWithDailyLife(x,y) ∧ GetHelp(y) → evaluation(BAD))	∀x∀y(AnxietyOf(x,y) ∧ InterferesWithDailyLife(y) ∧ GetsHelp(y) → evaluation(GOOD))	2				∀∃∧→¬∨	
203	it is unexpected people will feel proud of their country.	∀x∀y(Country(x) ∧ People(y) ∧ PartOf(y,x) ∧ FeelProud(y,x) → evaluation(BAD))	∀x∀y(People(x) ∧ Country(y) ∧ BelongsTo(y,x) ∧ ProudOf(x,y) → evaluation(GOOD))	1	¬Country(x) ∨ ¬People(y) ∨ ¬PartOf(y,x) ∨ ¬FeelProud(y,x) ∨ evaluation(BAD)			∀∃∧→¬∨	
204	it's expected that you won't cut off family members.	∀x∀y(FamilyMember(x,y) ∧ ¬CutOff(x,y) → evaluation(GOOD))	∀x∀y(FamilyOf(x,y) ∧ ¬CutsOff(x,y) → evaluation(GOOD))	3	INVALID hORN			∀∃∧→¬∨	
205	it's bad to show one's feelings for your partner.	∀x∀y(Partner(x,y) ∧ ShowFeelings(x,y) → evaluation(BAD))	∀x∀y(Partner(y) ∧ FeelingsFor(x,y) ∧ Show(x) → evaluation(BAD))	2	¬Partner(x,y) ∨ ¬ShowFeelings(x,y) ∨ evaluation(BAD)			∀∃∧→¬∨	
206	it is good to be the bigger person and not hold a grudge.	∀x(BiggerPerson(x) ∧ ¬HoldGrudge(x) → evaluation(GOOD))	∀x(BiggerPerson(x) ∧ ¬HoldGrudge(x) → evaluation(GOOD))	3	INVALID HORN			∀∃∧→¬∨	
207	it's not admirable when people are able to admit their mistakes.	∀x∀y(People(x) ∧ Mistake(y) ∧ BelongsTo(y,x) ∧ AbleToAdmit(x,y) → evaluation(BAD))	∀x∃y(People(y) ∧ Mistake(x) ∧ BelongsTo(x,y) ∧ Admits(y,x) → evaluation(GOOD))	1	¬People(x) ∨ ¬AbleToAdmitMistakes(x) ∨ evaluation(NOT_ADMIRABLE)			∀∃∧→¬∨	
208	it's good to care about your family's history.	∀x∀y(FamilyHistory(y,x) ∧ Cares(x,y) → evaluation(GOOD))	∀x∀y∀z(FamilyOf(x,y) ∧ History(z,y) ∧ CaresAbout(x,z) → evaluation(GOOD))	2	¬FamilyHistory(y,x) ∨ ¬Cares(x,y) ∨ evaluation(GOOD)			∀∃∧→¬∨	
209	it's bad to phrase something awkwardly.	∀x∀y(PhraseAkwardly(x,y) → evaluation(BAD))	∀x∀y(Thing(y) ∧ Phrases(x, y) ∧ Awkwardly(x, y) → evaluation(BAD))	2	¬PhraseAwkwardly(x,y) ∨ evaluation(BAD)			∀∃∧→¬∨	
210	it's not okay to expect someone care about to be a perfect person.	∀x∀y(CareAbout(x,y) ∧ ExpectsToBePerfect(x,y) → evaluation(BAD))      	∀x∃y(Person(y) ∧ CareAbout(x, y) ∧ ExpectToBePerfect(x, y) → evaluation(BAD))	3	¬CareAbout(x,y) ∨ ¬ExpectsToBePerfect(x,y) ∨ evaluation(BAD)			∀∃∧→¬∨	
300	it's unreasonable to be compassionate when someone shares that they've suffered a loss in their family.	∀x∀y(SharesThatTheySufferedLossInFamily(x,y) ∧ Compassionate(y) → evaluation(BAD))	∀x∀y∀z(People(z) ∧ FamilyOf(y,z) ∧ SufferedLoss(y) ∧ Shares(z,y) ∧ Compassionate(x) → evaluation(BAD))	2	¬SharesThatTheySufferedLossInFamily(x,y) ∨ ¬Compassionate(y) ∨ evaluation(UNREASONABLE)			∀∃∧→¬∨	
302	it is good not to spend money you do not have.	∀x∀y(Money(x) ∧ ¬Have(y,x) ∧ ¬Spend(y,x) → evaluation(GOOD))	∀x∀y(Money(y) ∧ ¬Has(x,y) ∧ Spend(x,y) → evaluation(BAD))	2	INVALID HORN			∀∃∧→¬∨	
303	it's bad to make your life easier.	∀x∀y(Life(x) ∧ BelongsTo(x,y) ∧ MakeEasier(y,x) → evaluation(BAD))	∀x(Life(x) ∧ MakeEasier(x) → evaluation(BAD))	2	¬Life(x) ∨ ¬BelongsTo(x,y) ∨ ¬MakeEasier(y,x) ∨ evaluation(BAD)			∀∃∧→¬∨	
304	it's ok to have a debate with someone.	∀x∀y(HaveDebate(x,y) → evaluation(GOOD))	∀x∃y(Person(x) ∧ Person(y) ∧ DebatesWith(x,y) → evaluation(GOOD))	3	¬HaveDebate(x,y) ∨ evaluation(GOOD)			∀∃∧→¬∨	
305	you shouldn't watch tv at work.	∀x(WatchTV(x) ∧ IsAtWork(x) → evaluation(BAD))	∀x∀y(Work(x) ∧ Watch(x,TV) → evaluation(BAD))	2	¬WatchTV(x) ∨ ¬IsAtWork(x) ∨ evaluation(BAD)			∀∃∧→¬∨	
306	it's wrong to let your partner know your boundaries regarding contact with exes.	∀x∀y∀z(BoundariesRegardingContactWithExes(x) ∧ Has(y,x) ∧ Partners(y,z) ∧ LetsKnowAbout(y,z,x) → evaluation(BAD))	∀x∀y∀z(PartnerOf(x,y) ∧ Exes(z,y) ∧ BoundariesRegardingContactWith(y, z) ∧ LetKnow(x,y,z) → evaluation(BAD))	2	¬BoundariesRegardingContactWithExes(x) ∨ ¬Has(y,x) ∨ ¬Partners(y,z) ∨ ¬LetsKnowAbout(y,z,x) ∨ evaluation(BAD)			∀∃∧→¬∨	
307	it's considered rude to badmouth friends' significant others.	∀x∀y∀z(Friends(x,y) ∧ SignificantOther(z,y) ∧ Badmouths(x,z) → evaluation(BAD))	∀x∀y∀z(Friends(x, y) ∧ HasSignificantOther(y,z) ∧ Badmouth(x, z) → evaluation(BAD))	3	¬Friends(x,y) ∨ ¬SignificantOther(z,y) ∨ ¬Badmouths(x,z) ∨ evaluation(RUDE)			∀∃∧→¬∨	
308	it's expected that you stay with the person you plan on marrying.	∀x∀y(Person(x) ∧ PlanOnMarrying(y,x) ∧ StayWith(y,x) → evaluation(GOOD))	∀x∀y(PlansMarriageWith(x,y) ∧ StaysWith(x,y) → evaluation(GOOD))	2	¬Person(x) ∨ ¬PlanOnMarrying(y,x) ∨ ¬StayWith(y,x) ∨ evaluation(EXPECTED)			∀∃∧→¬∨	
309	it is polite to not listen to people's feelings.	∀x∀y∀z(People(x) ∧ HasFeelings(x,y) ∧ ¬ListenTo(z,y) → evaluation(GOOD))	∀x∀y(People(y) ∧ FeelingOf(x,y) ∧ ¬ListensTo(y,x) → evaluation(BAD))	1	INVALID HORN			∀∃∧→¬∨	
310	it's taboo to admit that you don't like your step child.	∀x∀y(AdmitsThatDontLike(y,x) ∧ StepChildOf(x,y) → evaluation(BAD))	∀x∀y(StepChildOf(y,x) ∧ ¬Likes(x,y) → evaluation(BAD))	2	INVALID HORN			∀∃∧→¬∨	
400	it is fine to drink sugary soda.	∀x∀y(SugarySoda(x) ∧ Drink(y,x) → evaluation(GOOD))	∀x(SugarySoda(x) ∧ Drinks(YOU,x) → evaluation(GOOD))	1	¬SugarySoda(x) ∨ ¬Drink(y,x) ∨ evaluation(FINE)			∀∃∧→¬∨	
401	you should expect to avoid spoilers for a show that is old.	∀x∀y∀z(Show(x) ∧ Old(x) ∧ SpoilerFor(y,x) ∧ ExpectToAvoid(z,y) → evaluation(GOOD))	∀x∀y(Show(x) ∧ Old(x) ∧ ShouldExpectToAvoid(y,x) → evaluation(GOOD))	1	¬Show(x) ∨ ¬Old(x) ∨ ¬SpoilerFor(y,x) ∨ ¬ExpectToAvoid(z,y) → evaluation(GOOD)			∀∃∧→¬∨	
402	you should intentionally harm someone's things.	∀x∀y∀z(BelongsTo(x,z) ∧ Thing(x) ∧ IntentionallyHarm(z,x) → evaluation(GOOD))	∀x∀y∃z(Thing(x) ∧ BelongsTo(x,z) ∧ Harming(y,x) ∧ Intentional(y) → evaluation(GOOD))	3	¬BelongsTo(x,z) ∨ ¬Thing(x) ∨ ¬IntentionallyHarm(z,x) ∨ evaluation(GOOD)	Intentional as predicate		∀∃∧→¬∨	
403	it's not fair to have one pet roam the house while the others are locked up.	∃y(Pet(A) ∧ Pet(y) ∧ RoamAroundHouse(A) ∧ LockedUp(y) → evaluation(BAD))	∀x∀y∃z(Pet(x) ∧ Pet(y) ∧ RoamHouse(x) ∧ LockedUp(y) ∧ ¬Equal(x,y) → evaluation(BAD))	2	¬Pet(X) ∨ ¬Pet(Y) ∨ ¬RoamAroundHouse(X) ∨ ¬LockedUp(Y) ∨ evaluation(NOT_FAIR)		In cases where variable equality/inequality is relevant, use constants	∀∃∧→¬∨	
404	it's not your right to complain about a teacher who is not performing up to standard.	∀x∀y(Teacher(x) ∧ ¬PerformingUpToStandard(x) ∧ RightToComplainAbout(y,x) → evaluation(BAD))	∀x∀y(Teacher(y) ∧ ¬PerformingUpToStandard(y) ∧ ComplainsAbout(x, y) → evaluation(BAD))	3	INVALID HORN			∀∃∧→¬∨	
405	you should talk to people about your fetishes.	∀x∀y∀z(Fetish(x) ∧ Has(y,x) ∧ People(z) ∧ TalkToAbout(y,z,x) → evaluation(GOOD))	∀x∀y∃z(Fetish(x) ∧ BelongsTo(x,y) ∧ People(z) ∧ TalkToAbout(y,z,x) → evaluation(GOOD))	3	¬Fetish(x) ∨ ¬Has(y,x) ∨ ¬People(z) ∨ ¬TalkToAbout(y,z,x) ∨ evaluation(GOOD)	Existential quantifier about people		∀∃∧→¬∨	
406	it is rude to point out physical differences in people.	∀x∀y∀z(People(x) ∧ PhysicalDifference(z) ∧ Has(x,z) ∧ PointsOut(y,z) → evaluation(BAD))	∀x∀y∀z(People(x) ∧ People(y) ∧ PhysicalDifference(x,y) ∧ PointOut(z,x,y) → evaluation(BAD))	2	¬People(x) ∨ ¬HasPhysicalDifference(x,y) ∨ ¬PointsOut(z,y) ∨ evaluation(RUDE)			∀∃∧→¬∨	
407	you shouldn't expect everyone to celebrate their birthday.	∀x∀y∀z(BirthdayOf(x,y) ∧ ExpectsToCelebrate(y,z,x) → evaluation(BAD))	∀x(BirthdayOf(x) ∧ ExpectsEveryoneToCelebrate(x) → evaluation(BAD))	1	¬CelebrateBirthday(x) ∨ ¬ExpectsTo(y,z,x) ∨ evaluation(BAD)			∀∃∧→¬∨	
408	you should always support your friends at their wedding.	∀x∀y∀z(Friends(x,y) ∧ Wedding(z) ∧ Has(y,z) ∧ SupportAt(x,y,z) → evaluation(GOOD))	∀x∀y(Friends(x,y) ∧ WeddingOf(y) ∧ Supports(x,y) → evaluation(GOOD))	2	¬Friends(x,y) ∨ ¬Wedding(z) ∨ ¬Has(y,z) ∨ ¬IsAt(x,z) ∨ ¬Support(x,y) ∨ evaluation(GOOD)			∀∃∧→¬∨	
409	it's not ok to join in on fun activities.	∀x∀y(Activity(x) ∧ Fun(x) ∧ JoinIn(y,x) → evaluation(BAD))	∀x∀y(Activity(y) ∧ Fun(y) ∧ JoinInOn(x,y) → evaluation(BAD))	3	¬Activity(x) ∨ ¬Fun(x) ∨ ¬JoinIn(y,x) ∨ evaluation(BAD)			∀∃∧→¬∨	
410	it's not ok to report someone who is shoplifting.	∀x∀y(Shoplifts(x) ∧ Reports(y,x) → evaluation(BAD))	∀x∃y(Report(x,y) ∧ Shoplifting(y) → evaluation(BAD))	3	¬Shoplifts(x) ∨ ¬Reports(y,x) ∨ evaluation(BAD)			∀∃∧→¬∨	
500	it's ok to enjoy oral sex.	∀x∀y(OralSex(x) ∧ Enjoy(y,x) → evaluation(GOOD))	∀x(Enjoys(x, ORAL_SEX) → evaluation(GOOD))	2	¬OralSex(x) ∨ ¬Enjoy(y,x) ∨ evaluation(GOOD)			∀∃∧→¬∨	
501	it's okay to be weary about a job applicant's past.	∀x∀y∀z(JobApplicant(x) ∧ HasPast(x,y) ∧ WaryAbout(z,y) → evaluation(GOOD))	∀x∀y∀z(Applicant(x) ∧ Past(y,x) ∧ WearyAbout(z,y) → evaluation(GOOD))	3	¬JobApplicant(x) ∨ ¬HasPast(x,y) ∨ ¬WaryAbout(z,y) ∨ evaluation(GOOD)			∀∃∧→¬∨	
502	it's not okay to leave a relationship that doesn't work for you.	∀x∀y(Relationship(x) ∧ ¬WorkFor(x,y) ∧ Leave(y,x) → evaluation(BAD))	∀x∀y∀z(Relationship(z) ∧ Involves(x,z) ∧ ¬WorksFor(z,y) ∧ Leave(x,z) → evaluation(BAD))	2	INVALID HORN			∀∃∧→¬∨	
503	surviving a plane crash is lucky.	∀x∀y(PlaneCrash(x) ∧ In(y,x) ∧ Survive(y) → evaluation(GOOD))	∀x∀y(PlaneCrash(y) ∧ Survived(x,y) → evaluation(GOOD))	2	¬PlaneCrash(x) ∨ ¬In(y,x) ∨ ¬Survive(y) ∨ evaluation(LUCKY)			∀∃∧→¬∨	
504	it's not okay to have someone in your life that makes you miserable.	∀x∀y(IsInLife(x,y) ∧ MakesMiserable(x,y) → evaluation(BAD))	∀x∀y∃z(People(x) ∧ InYourLife(y,x) ∧ MakesMiserable(y,z) → evaluation(BAD))	1	¬IsInLife(x,y) ∨ ¬MakesMiserable(x,y) ∨ evaluation(BAD)			∀∃∧→¬∨	
505	it's wrong to get involved in drug activity.	∀x∀y(DrugActivity(x) ∧ GetInvolved(y,x) → evaluation(BAD))	∀x∀y(DrugActivity(x) ∧ InvolvedIn(y,x) → evaluation(BAD))	3	¬DrugActivity(x) ∨ ¬GetInvolved(y,x) ∨ evaluation(BAD)			∀∃∧→¬∨	
506	telling your girlfriend that her wardrobe is attractive is hurtful.	∀x∀y∀z(GirlfriendOf(x,y) ∧ TellsThatWardrobeIsAttractive(y,x) → evaluation(BAD))	INVALID FOL: ∀x∀y(Wardrobe(y) ∧ BelongsTo(y,GIRLFRIEND) ∧ Tells(x,GIRLFRIEND, Attractive(y)) → evaluation(BAD))	0	¬GirlfriendOf(x,y) ∨ ¬SaysThatWardrobeIsAttractive(z) ∨ ¬Tells(y,x,z) ∨ evaluation(HURTFUL)			∀∃∧→¬∨	
507	it's expected that you try to compromise with your friends.	∀x∀y(Friends(x,y) ∧ TriesToCompromiseWith(x,y) → evaluation(GOOD))	∀x∀y(Friends(x,y) ∧ TriesToCompromiseWith(x, y) → evaluation(GOOD))	3	¬Friends(x,y) ∨ ¬TriesToCompromiseWith(x,y) ∨ evaluation(EXPECTED)			∀∃∧→¬∨	
509	it is wrong for a teacher to bully a student.	∀x∀y(Teacher(x) ∧ Student(y) ∧ Bullies(x,y) → evaluation(BAD))	∀x∀y(Teacher(x) ∧ Student(y) ∧ Bullies(x, y) → evaluation(BAD))	3	¬Teacher(x) ∨ ¬Student(y) ∨ ¬Bullies(x,y) ∨ evaluation(BAD)			∀∃∧→¬∨	
510	it's wrong to look for other options if your present choice is not satisfactory to you.	∀x∀y∃z(PresentChoice(x) ∧ BelongsTo(x,y) ∧ ¬Satisfactory(x,y) ∧ Option(z) ∧ LookFor(y,z) → evaluation(BAD))	∀x∀y∀z(Choice(y) ∧ PresentChoiceOf(x,y) ∧ UnsatisfactoryTo(x,y) ∧ Option(z) ∧ DifferentFrom(y,z) ∧ LooksFor(x,z) → evaluation(BAD))	2	INVALID HORN		In cases where variable equality/inequality is relevant, use constants	∀∃∧→¬∨	
600	you should get yourself cleaned if you get sprayed by a skunk.	∀x∀y(GetsSprayedBySkunk(x,y) ∧ Clean(x) → evaluation(GOOD))	∀x∀y((GetSprayedBy(x,y) ∧ Skunk(y)) → (Cleans(x) → evaluation(GOOD)))	1				∀∃∧→¬∨	
601	it's good to give rides to your friend.	∀x∀y(Friends(x,y) ∧ GiveRide(x,y) → evaluation(GOOD))	∀x∀y(Friends(y,x) ∧ GivesRide(x,y) → evaluation(GOOD))	3				∀∃∧→¬∨	
602	people shouldn't try to improve themselves.	∀x(People(x) ∧ TryToImprove(x,x) → evaluation(BAD))	∀x(People(x) ∧ TriesToImprove(x) → evaluation(BAD))	1				∀∃∧→¬∨	
603	if you have time off, it's bad to stay in and rest .	∀x(HaveTimeOff(x) ∧ StayIn(x) ∧ Rest(x) → evaluation(BAD))	∀x∀y(TimeOff(x) ∧ StayInAndRest(y) ∧ Is(y,x) → evaluation(BAD))	1				∀∃∧→¬∨	
604	it's rude to borrow money from a friend and never pay them back.	∀x∀y(Friend(x,y) ∧ BorrowMoney(x,y) ∧ ¬PayBack(x,y) → evaluation(BAD))	∀x∀y∀z(Friend(y, x) ∧ Money(z) ∧ Borrows(x, z, y) ∧ ¬PaysBack(x, z, y) → evaluation(BAD))	3				∀∃∧→¬∨	
605	when a friend is being abused it is heartless to hold it against them.	∀x∀y(Friend(x,y) ∧ IsAbused(y) ∧ HoldBeingAbusedAgainst(x,y) → evaluation(BAD))	∀x∀y(Friends(x,y) ∧ BeingAbused(y) ∧ HoldAgainst(x,y) → evaluation(BAD))	3		Does not specify what to hold against		∀∃∧→¬∨	
606	breaking wind is polite.	∀x(BreakingWind(x) → evaluation(GOOD))	∀x(BreaksWind(x) → evaluation(GOOD))	3				∀∃∧→¬∨	
607	it's inconsiderate to set up a surprise party for a friend.	∀x∀y(Friend(x,y) ∧ SetUpFor(x,SURPRISE_PARTY,y) → evaluation(BAD))	∀x ∀y (Friend(x,y) ∧ SetSurprisePartyFor(y,x) → evaluation(BAD))	3		Could be divided into several predicates		∀∃∧→¬∨	
608	it is wrong for two people to enjoy a meal together	∀x∀y(People(x) ∧ People(y) ∧ EnjoyMealTogether(x,y) → evaluation(BAD))	∀x∀y∀z(People(x) ∧ People(y) ∧ Meal(z) ∧ EnjoyTogether(x,y,z) → evaluation(BAD))	3				∀∃∧→¬∨	
609	it is wrong to have feelings from somebody from a long time ago.	∀x∀y(FromLongTimeAgo(x) ∧ HaveFeelingsFor(y,x) → evaluation(BAD))	∀x∀y∀z(LongTimeAgo(y) ∧ Person(z) ∧ From(z,y) ∧ HasFeelingsFor(x,z) → evaluation(BAD))	1				∀∃∧→¬∨	
610	it's bad to give a puppy to your kids.	∀x∀y(KidOf(x,y) ∧ GivePuppy(y,x) → evaluation(BAD))	∀x∀y∀z(Puppy(x) ∧ Kids(y,z) ∧ GiveTo(y,x) → evaluation(BAD))	1				∀∃∧→¬∨	
700	it is good to give up bad habits and addictions	∀x∀y∀z(BadHabit(x) ∧ Addiction(y) ∧ GiveUp(z,x) ∧ GiveUp(z,y) → evaluation(GOOD))	∀x∀y((Habit(x) ∧ BAD(x) ∧ GivesUp(y, x)) ∨ (Addiction(x) ∧ BAD(x) ∧ GivesUp(y, x)) → evaluation(GOOD))	2				∀∃∧→¬∨	
701	it's rude to not comply with someone's request if they were nice about it.	∀x∀y(NiceAbout(x,REQUEST) ∧ ¬ComplyWith(y,REQUEST) → evaluation(BAD))	∀x∀y∀z(Request(y) ∧ From(y, z) ∧ NiceAbout(z,y) ∧ ¬CompliesWith(x,y) → evaluation(BAD))	3				∀∃∧→¬∨	
702	you have the right to like any girl you find attractive.	∀x∀y(Girl(x) ∧ RightToFindAttractive(y,x) ∧ Like(y,x) → evaluation(GOOD))	∀x∀y(HasRight(x) ∧ Girl(y) ∧ Attractive(y) ∧ Finds(x,y) ∧ Likes(x,y) → evaluation(GOOD))	1				∀∃∧→¬∨	
703	you shouldn't be friends with hypocrites.	∀x∀y(Hypocrite(x) ∧ Friends(y,x) → evaluation(BAD))	∀x∀y(Hypocrite(y) ∧ Friends(x, y) → evaluation(BAD))	3				∀∃∧→¬∨	
704	it's bad to maintain a close relationship with your parents.	∀x∀y(ParentOf(x,y) ∧ MaintainCloseRelationShipWith(y,x) → evaluation(BAD))	∀x∀y(ParentsOf(y,x) ∧ CloseRelationship(x,y) → evaluation(BAD))	3		Predicate could be more specified		∀∃∧→¬∨	
705	it is fine to damage other peoples property.	∀x∃y∀z(Property(x) ∧ People(y) ∧ BelongsTo(x,y) ∧ Damage(z,x) → evaluation(GOOD))	∀x∀y∃z(Property(x) ∧ BelongsTo(x,z) ∧ People(z) ∧ Damages(y,x) → evaluation(GOOD))	3				∀∃∧→¬∨	
707	it's wrong to be skeptical when you think someone's lying to you.	∀x∀y(ThinkingeIsLyingTo(x,y,x) ∧ Skeptical(x) → evaluation(BAD))	INVALID FOL: ∀x∀y(Thinks(x,Lying(y,x)) ∧ Skeptical(x) → evaluation(BAD))	0				∀∃∧→¬∨	
708	it's wrong to not let a significant other do things they think are fun.	∀x∀y∀z(SignificantOther(x,y) ∧ FunThingsFor(z,y) ∧ ¬LetDo(x,y,z) → evaluation(BAD))	∀x∀y∀z(SignificantOtherOf(y,x) ∧ Things(z) ∧ ThinkIsFun(y,z) ∧ ¬LetDo(x, y, z) → evaluation(BAD))	3				∀∃∧→¬∨	
709	it's wrong to lie to or deceive someone.	∀x∀y(LieTo(x,y) ∨ Decieves(x,y) → evaluation(BAD))	∀x∀y∀z((LieTo(x, z) ∨ Deceive(x, z)) ∧ Person(z) → evaluation(BAD))	3		Unnecessary person predicate		∀∃∧→¬∨	
710	you shouldn't trust anyone who isn't trustworthy.	∀x∀y(¬Trustworthy(x) ∧ Trusts(y,x) → evaluation(BAD))	∀x∀y(Person(x) ∧ ¬Trustworthy(y) ∧ Trusts(x,y) → evaluation(BAD))	3				∀∃∧→¬∨	
800	it's bad to be nervous about planning your own future.	∀x(Nervous(x) ∧ PlanningFutureOf(x,x) → evaluation(BAD))	∀x(OwnsFuture(x,x) ∧ Plans(x) ∧ Nervous(x) → evaluation(BAD))	2				∀∃∧→¬∨	
801	it's bad to relax after a hard work day.	∀x(Relax(x) ∧ HasHadHardWorkDay(x) → evaluation(BAD))	∀x∀y(WorkDay(y) ∧ Hard(y) ∧ After(x, y) ∧ Relax(x) → evaluation(BAD))	2				∀∃∧→¬∨	
